,category,githuburl,featured,links,description,_repopath,_reponame,_stars,_forks,_watches,_topics,_language,_homepage,_description,_organization,_updated_at,_last_commit_date,_created_at,_age_weeks,_stars_per_week
89,ml-dl,https://github.com/tensorflow/tensorflow,,,,tensorflow/tensorflow,tensorflow,167732,87171,7812,"['tensorflow', 'machine-learning', 'python', 'deep-learning', 'deep-neural-networks', 'neural-network', 'ml', 'distributed']",C++,https://tensorflow.org,tensorflow: An Open Source Machine Learning Framework for Everyone,tensorflow,2022-09-15,2022-09-15,2015-11-07,357,468.8993610223642
407,util,https://github.com/thealgorithms/python,,,,thealgorithms/python,Python,144013,36754,6034,"['python', 'algorithm', 'algorithms-implemented', 'algorithm-competitions', 'algos', 'sorts', 'searches', 'sorting-algorithms', 'education', 'learn', 'practice', 'community-driven', 'interview', 'hacktoberfest']",Python,https://the-algorithms.com/,Python: All Algorithms implemented in Python,thealgorithms,2022-09-15,2022-09-14,2016-07-16,321,447.64253996447604
112,nlp,https://github.com/huggingface/transformers,,,,huggingface/transformers,transformers,70243,16117,854,"['nlp', 'natural-language-processing', 'pytorch', 'language-model', 'tensorflow', 'bert', 'language-models', 'pytorch-transformers', 'nlp-library', 'transformer', 'model-hub', 'pretrained-models', 'jax', 'flax', 'seq2seq', 'speech-recognition', 'hacktoberfest', 'python', 'machine-learning', 'deep-learning']",Python,https://huggingface.co/transformers,"🤗 Transformers: State-of-the-art Machine Learning for Pytorch, TensorFlow, and JAX.",huggingface,2022-09-15,2022-09-14,2018-10-29,202,347.0014114326041
14,web,https://github.com/django/django,,,,django/django,django,66281,27761,2288,"['python', 'django', 'web', 'framework', 'orm', 'templates', 'models', 'views', 'apps']",Python,https://www.djangoproject.com/,django: The Web framework for perfectionists with deadlines.,django,2022-09-15,2022-09-14,2012-04-28,541,122.35416666666667
57,web,https://github.com/pallets/flask,,,,pallets/flask,flask,60534,15238,2151,"['python', 'flask', 'wsgi', 'web-framework', 'werkzeug', 'jinja', 'pallets']",Python,https://flask.palletsprojects.com,flask: The Python micro framework for building web applications.,pallets,2022-09-15,2022-09-14,2010-04-06,649,93.23168316831683
76,ml-dl,https://github.com/pytorch/pytorch,,,,pytorch/pytorch,pytorch,58781,16365,1607,"['neural-network', 'autograd', 'gpu', 'numpy', 'deep-learning', 'tensor', 'python', 'machine-learning']",C++,https://pytorch.org,pytorch: Tensors and Dynamic neural networks in Python with strong GPU acceleration,pytorch,2022-09-15,2022-09-15,2016-08-13,317,185.0121402877698
40,ml-dl,https://github.com/keras-team/keras,,,,keras-team/keras,keras,56141,19182,1941,"['deep-learning', 'tensorflow', 'neural-networks', 'machine-learning', 'data-science', 'python']",Python,http://keras.io/,keras: Deep Learning for humans,keras-team,2022-09-15,2022-09-15,2015-03-28,389,144.0568181818182
191,util,https://github.com/home-assistant/core,,,,home-assistant/core,core,54825,19579,1357,"['python', 'home-automation', 'iot', 'internet-of-things', 'mqtt', 'raspberry-pi', 'asyncio']",Python,https://www.home-assistant.io,core: :house_with_garden: Open source home automation that puts local control and privacy first.,home-assistant,2022-09-15,2022-09-15,2013-09-17,469,116.82648401826484
78,ml,https://github.com/scikit-learn/scikit-learn,,,,scikit-learn/scikit-learn,scikit-learn,51362,23407,2180,"['machine-learning', 'python', 'statistics', 'data-science', 'data-analysis']",Python,https://scikit-learn.org,scikit-learn: machine learning in Python,scikit-learn,2022-09-15,2022-09-14,2010-08-17,630,81.49002719854941
136,web,https://github.com/tiangolo/fastapi,,,,tiangolo/fastapi,fastapi,49450,3946,601,"['python', 'json', 'swagger-ui', 'redoc', 'starlette', 'openapi', 'api', 'openapi3', 'framework', 'async', 'asyncio', 'uvicorn', 'python3', 'python-types', 'pydantic', 'json-schema', 'fastapi', 'swagger', 'rest', 'web']",Python,https://fastapi.tiangolo.com/,"FastAPI framework, high performance, easy to learn, fast to code, ready for production",tiangolo,2022-09-15,2022-09-14,2018-12-08,196,251.37981118373276
179,web,https://github.com/psf/requests,,,,psf/requests,requests,48224,8868,1365,"['python', 'http', 'forhumans', 'requests', 'python-requests', 'client', 'humans', 'cookies']",Python,https://requests.readthedocs.io/en/latest/,"requests: A simple, yet elegant, HTTP library.",psf,2022-09-15,2022-09-09,2011-02-13,604,79.765595463138
401,util,https://github.com/python/cpython,,,,python/cpython,cpython,47499,24170,1445,[],Python,https://www.python.org/,cpython: The Python programming language,python,2022-09-15,2022-09-15,2017-02-10,291,162.74743024963288
80,data,https://github.com/scrapy/scrapy,,,,scrapy/scrapy,scrapy,44523,9714,1794,"['python', 'scraping', 'crawling', 'framework', 'crawler', 'hacktoberfest']",Python,https://scrapy.org,"Scrapy, a fast high-level web crawling & scraping framework for Python.",scrapy,2022-09-15,2022-09-14,2010-02-22,655,67.9295989537925
697,ml-dl,https://github.com/deepfakes/faceswap,,,,deepfakes/faceswap,faceswap,42243,11897,1507,"['faceswap', 'face-swap', 'deep-learning', 'deeplearning', 'deep-neural-networks', 'deepfakes', 'deepface', 'deep-face-swap', 'fakeapp', 'neural-networks', 'neural-nets', 'openfaceswap', 'myfakeapp', 'machine-learning']",Python,https://www.faceswap.dev,faceswap: Deepfakes Software For All,deepfakes,2022-09-15,2022-09-14,2017-12-19,247,170.82668977469672
181,term,https://github.com/willmcgugan/rich,,,,willmcgugan/rich,rich,39623,1346,539,"['python', 'python3', 'python-library', 'terminal', 'terminal-color', 'markdown', 'tables', 'syntax-highlighting', 'ansi-colors', 'progress-bar-python', 'progress-bar', 'traceback', 'rich', 'tracebacks-rich', 'emoji']",Python,https://rich.readthedocs.io/en/latest/,Rich is a Python library for rich text and beautiful formatting in the terminal.,willmcgugan,2022-09-15,2022-09-08,2019-11-10,148,266.6932692307692
434,study,https://github.com/jakevdp/pythondatasciencehandbook,,,,jakevdp/pythondatasciencehandbook,PythonDataScienceHandbook,35851,15927,1768,"['scikit-learn', 'numpy', 'python', 'jupyter-notebook', 'matplotlib', 'pandas']",Jupyter Notebook,http://jakevdp.github.io/PythonDataScienceHandbook,PythonDataScienceHandbook: Python Data Science Handbook: full text in Jupyter Notebooks,jakevdp,2022-09-15,2018-11-30,2016-08-10,318,112.68837000449035
264,web,https://github.com/sherlock-project/sherlock,,,,sherlock-project/sherlock,sherlock,35385,4145,953,"['osint', 'reconnaissance', 'linux', 'macos', 'cli', 'sherlock', 'python3', 'windows', 'redteam', 'tools', 'information-gathering', 'hacktoberfest']",Python,http://sherlock-project.github.io,sherlock: 🔎 Hunt down social media accounts by username across social networks,sherlock-project,2022-09-15,2022-09-08,2018-12-24,194,181.9948567229978
59,data,https://github.com/pandas-dev/pandas,,,,pandas-dev/pandas,pandas,35197,14967,1122,"['data-analysis', 'pandas', 'flexible', 'alignment', 'python', 'data-science']",Python,https://pandas.pydata.org,"pandas: Flexible and powerful data analysis / manipulation library for Python, providing labeled data structures similar to R data.frame objects, statistical functions, and much more",pandas-dev,2022-09-15,2022-09-15,2010-08-24,629,55.9316685584563
696,ml-dl,https://github.com/iperov/deepfacelab,,,,iperov/deepfacelab,DeepFaceLab,34963,7890,1037,"['faceswap', 'face-swap', 'deep-learning', 'deeplearning', 'deep-neural-networks', 'deepfakes', 'deepface', 'deep-face-swap', 'fakeapp', 'neural-networks', 'neural-nets', 'deepfacelab', 'creating-deepfakes', 'arxiv', 'machine-learning']",Python,,DeepFaceLab is the leading software for creating deepfakes.,iperov,2022-09-15,2022-08-12,2018-06-04,223,156.48401534526855
64,util,https://github.com/psf/black,,,,psf/black,black,29123,1857,221,"['python', 'code', 'formatter', 'codeformatter', 'gofmt', 'yapf', 'autopep8', 'pre-commit-hook']",Python,https://black.readthedocs.io/en/stable/,black: The uncompromising Python code formatter,psf,2022-09-15,2022-09-15,2018-03-14,235,123.85236938031592
222,util,https://github.com/pyenv/pyenv,,,,pyenv/pyenv,pyenv,28705,2557,385,"['python', 'shell']",Roff,,pyenv: Simple Python version management,pyenv,2022-09-15,2022-09-14,2012-08-31,523,54.79547313880556
55,sim,https://github.com/openai/gym,,,,openai/gym,gym,28520,7964,991,[],Python,https://www.gymlibrary.dev,gym: A toolkit for developing and comparing reinforcement learning algorithms.,openai,2022-09-15,2022-09-14,2016-04-27,333,85.60891938250428
118,ml-ops,https://github.com/apache/airflow,,,,apache/airflow,airflow,27445,11201,754,"['airflow', 'apache', 'apache-airflow', 'python', 'scheduler', 'workflow', 'hacktoberfest']",Python,https://airflow.apache.org/,"airflow: Apache Airflow - A platform to programmatically author, schedule, and monitor workflows",apache,2022-09-15,2022-09-15,2015-04-13,387,70.83886430678466
594,util,https://github.com/mingrammer/diagrams,,,,mingrammer/diagrams,diagrams,25873,1568,348,"['diagram', 'diagram-as-code', 'architecture', 'graphviz']",Python,https://diagrams.mingrammer.com,diagrams: :art: Diagram as Code for prototyping cloud system architectures,mingrammer,2022-09-15,2022-09-13,2020-02-02,136,189.44665271966528
259,crypto,https://github.com/ccxt/ccxt,,,,ccxt/ccxt,ccxt,25675,6287,927,"['altcoin', 'api', 'arbitrage', 'bitcoin', 'bot', 'cryptocurrency', 'crypto', 'e-commerce', 'ethereum', 'exchange', 'invest', 'library', 'strategy', 'trading', 'btc', 'eth', 'trade', 'merchant', 'market-data']",JavaScript,,ccxt: A JavaScript / Python / PHP cryptocurrency trading API with support for more than 100 bitcoin/altcoin exchanges,ccxt,2022-09-15,2022-09-14,2017-05-14,278,92.16666666666667
679,ml-dl,https://github.com/facebookresearch/detectron,,,,facebookresearch/detectron,Detectron,25309,5456,963,[],Python,,"Detectron: FAIR's research platform for object detection research, implementing popular algorithms like Mask R-CNN and RetinaNet.",facebookresearch,2022-09-14,2021-03-27,2017-10-05,258,98.09689922480621
17,nlp,https://github.com/explosion/spacy,,,,explosion/spacy,spaCy,24185,3930,553,"['natural-language-processing', 'data-science', 'machine-learning', 'python', 'cython', 'nlp', 'artificial-intelligence', 'ai', 'spacy', 'nlp-library', 'neural-network', 'neural-networks', 'deep-learning', 'named-entity-recognition', 'entity-linking', 'text-classification', 'tokenization']",Python,https://spacy.io,spaCy: 💫 Industrial-strength Natural Language Processing (NLP) in Python,explosion,2022-09-15,2022-09-14,2014-07-03,428,56.507009345794394
103,ml,https://github.com/dmlc/xgboost,,,,dmlc/xgboost,xgboost,23178,8453,928,"['gbdt', 'gbrt', 'gbm', 'distributed-systems', 'xgboost', 'machine-learning']",C++,https://xgboost.ai/,"xgboost: Scalable, Portable and Distributed Gradient Boosting (GBDT, GBRT or GBM) Library,  for Python, R, Java, Scala, C++ and more. Runs on single machine, Hadoop, Spark, Dask, Flink and DataFlow",dmlc,2022-09-15,2022-09-14,2014-02-06,449,51.62138084632517
26,term,https://github.com/google/python-fire,,,,google/python-fire,python-fire,23001,1330,377,"['python', 'cli']",Python,,python-fire: Python Fire is a library for automatically generating command line interfaces (CLIs) from absolutely any Python object.,google,2022-09-15,2022-04-16,2017-02-21,290,79.2357283464567
165,term,https://github.com/tqdm/tqdm,1.0,,,tqdm/tqdm,tqdm,22913,1164,205,"['progressbar', 'progressmeter', 'progress-bar', 'meter', 'rate', 'console', 'terminal', 'time', 'progress', 'gui', 'python', 'parallel', 'cli', 'utilities', 'jupyter', 'discord', 'telegram', 'pandas', 'keras', 'closember']",Python,https://tqdm.github.io,"tqdm: A Fast, Extensible Progress Bar for Python and CLI",tqdm,2022-09-15,2022-09-03,2015-06-03,380,60.274708756106726
503,ml,https://github.com/ageron/handson-ml2,,,,ageron/handson-ml2,handson-ml2,22789,11018,613,[],Jupyter Notebook,,"handson-ml2: A series of Jupyter notebooks that walk you through the fundamentals of Machine Learning and Deep Learning in Python using Scikit-Learn, Keras and TensorFlow 2.",ageron,2022-09-15,2022-03-23,2019-01-08,192,118.51634472511144
738,ml-dl,https://github.com/compvis/stable-diffusion,,,,compvis/stable-diffusion,stable-diffusion,22305,3346,249,[],Jupyter Notebook,https://ommer-lab.com/research/latent-diffusion-models/,stable-diffusion: A latent text-to-image diffusion model,compvis,2022-09-15,2022-08-22,2022-08-10,5,4337.083333333333
680,ml-dl,https://github.com/facebookresearch/detectron2,,,,facebookresearch/detectron2,detectron2,22221,6015,348,[],Python,https://detectron2.readthedocs.io/en/latest/,"Detectron2 is a platform for object detection, segmentation and other visual recognition tasks.",facebookresearch,2022-09-15,2022-09-12,2019-09-05,158,140.63924050632912
247,ml,https://github.com/tencentarc/gfpgan,,,,tencentarc/gfpgan,GFPGAN,22165,3284,327,"['pytorch', 'gan', 'deep-learning', 'super-resolution', 'face-restoration', 'image-restoration', 'gfpgan']",Python,,GFPGAN aims at developing Practical Algorithms for Real-world Face Restoration.,tencentarc,2022-09-15,2022-09-12,2021-03-19,77,284.6880733944954
691,ml-dl,https://github.com/matterport/mask_rcnn,,,,matterport/mask_rcnn,Mask_RCNN,22159,11034,600,"['mask-rcnn', 'tensorflow', 'object-detection', 'instance-segmentation', 'keras']",Python,,Mask_RCNN: Mask R-CNN for object detection and instance segmentation on Keras and TensorFlow,matterport,2022-09-15,2019-03-31,2017-10-19,256,86.55859375
648,util,https://github.com/python-poetry/poetry,,,,python-poetry/poetry,poetry,21750,1747,176,"['python', 'dependency-manager', 'package-manager', 'packaging']",Python,https://python-poetry.org,poetry: Python dependency management and packaging made easy.,python-poetry,2022-09-15,2022-09-14,2018-02-28,237,91.71686746987952
651,util,https://github.com/keon/algorithms,,,,keon/algorithms,algorithms,21577,4393,642,"['algorithm', 'python', 'competitive-programming', 'data-structure', 'algorithms', 'sort', 'search', 'tree', 'graph']",Python,,algorithms: Minimal examples of data structures and algorithms in Python,keon,2022-09-15,2022-07-29,2016-11-17,304,70.97697368421052
54,math,https://github.com/numpy/numpy,,,,numpy/numpy,numpy,21437,7296,569,"['numpy', 'python']",Python,https://numpy.org,numpy: The fundamental package for scientific computing with Python.,numpy,2022-09-15,2022-09-14,2010-09-13,626,34.22098061573546
552,ml,https://github.com/open-mmlab/mmdetection,,,,open-mmlab/mmdetection,mmdetection,21307,7750,361,"['object-detection', 'instance-segmentation', 'rpn', 'fast-rcnn', 'faster-rcnn', 'mask-rcnn', 'cascade-rcnn', 'ssd', 'retinanet', 'pytorch']",Python,https://mmdetection.readthedocs.io,mmdetection: OpenMMLab Detection Toolbox and Benchmark,open-mmlab,2022-09-15,2022-09-05,2018-08-22,212,100.43703703703704
291,ml-dl,https://github.com/rwightman/pytorch-image-models,,,,rwightman/pytorch-image-models,pytorch-image-models,20872,3427,282,"['pytorch', 'imagenet-classifier', 'resnet', 'dual-path-networks', 'cnn-classification', 'pretrained-models', 'pretrained-weights', 'distributed-training', 'mobile-deep-learning', 'mobilenet-v2', 'mnasnet', 'mobilenetv3', 'efficientnet', 'augmix', 'randaugment', 'mixnet', 'efficientnet-training', 'vision-transformer-models', 'nfnets', 'normalization-free-training']",Python,https://rwightman.github.io/pytorch-image-models/,"pytorch-image-models: PyTorch image models, scripts, pretrained weights -- ResNet, ResNeXT, EfficientNet, EfficientNetV2, NFNet, Vision Transformer, MixNet, MobileNet-V3/V2, RegNet, DPN, CSPNet, and more",rwightman,2022-09-15,2022-09-14,2019-02-02,188,110.60105980317941
90,web,https://github.com/tornadoweb/tornado,,,,tornadoweb/tornado,tornado,20739,5473,1008,"['python', 'asynchronous']",Python,http://www.tornadoweb.org/,"Tornado is a Python web framework and asynchronous networking library, originally developed at FriendFeed.",tornadoweb,2022-09-14,2022-08-26,2009-09-09,679,30.537021455616323
86,viz,https://github.com/streamlit/streamlit,,,,streamlit/streamlit,streamlit,20615,1850,276,"['python', 'machine-learning', 'data-science', 'deep-learning', 'data-visualization', 'streamlit', 'data-analysis', 'developer-tools']",Python,https://streamlit.io,Streamlit — The fastest way to build data apps in Python,streamlit,2022-09-15,2022-09-13,2019-08-24,159,129.0742397137746
185,ml,https://github.com/google/jax,,,,google/jax,jax,20228,1852,289,['jax'],Python,http://jax.readthedocs.io/,"jax: Composable transformations of Python+NumPy programs: differentiate, vectorize, JIT to GPU/TPU, and more",google,2022-09-15,2022-09-15,2018-10-25,203,99.64532019704434
2,ml-dl,https://github.com/apache/incubator-mxnet,,,,apache/incubator-mxnet,incubator-mxnet,20078,6878,1093,['mxnet'],C++,https://mxnet.apache.org,"incubator-mxnet: Lightweight, Portable, Flexible Distributed/Mobile Deep Learning with Dynamic, Mutation-aware Dataflow Dep Scheduler; for Python, R, Julia, Scala, Go, Javascript and more",apache,2022-09-14,2022-09-08,2015-04-30,385,52.15064935064935
8,perf,https://github.com/celery/celery,,,,celery/celery,celery,20073,4357,475,"['python', 'task-manager', 'task-scheduler', 'task-runner', 'queue-workers', 'queued-jobs', 'queue-tasks', 'amqp', 'redis', 'sqs', 'sqs-queue', 'python3', 'python-library', 'redis-queue']",Python,https://docs.celeryq.dev,celery: Distributed Task Queue (development branch),celery,2022-09-14,2022-09-07,2009-04-24,698,28.72260834014718
254,ml-dl,https://github.com/pytorchlightning/pytorch-lightning,1.0,,,pytorchlightning/pytorch-lightning,lightning,20002,2578,225,"['python', 'deep-learning', 'artificial-intelligence', 'ai', 'pytorch', 'data-science', 'machine-learning']",Python,https://lightning.ai,"lightning: Build and train PyTorch models and connect them to the ML lifecycle using Lightning App templates, without handling DIY infrastructure, cost management, scaling, and other headaches.",pytorchlightning,2022-09-15,2022-09-15,2019-03-31,180,110.77056962025317
45,testing,https://github.com/locustio/locust,,,,locustio/locust,locust,19739,2544,428,"['locust', 'python', 'load-testing', 'performance-testing', 'http', 'benchmarking', 'load-generator']",Python,https://locust.io,locust: Scalable user load testing tool written in Python,locustio,2022-09-15,2022-09-15,2011-02-17,604,32.68046357615894
75,nlp,https://github.com/pytorch/fairseq,,,,pytorch/fairseq,fairseq,19161,4854,348,"['python', 'pytorch', 'artificial-intelligence']",Python,,fairseq: Facebook AI Research Sequence-to-Sequence Toolkit written in Python.,pytorch,2022-09-14,2022-09-15,2017-08-29,263,72.77645143787304
609,util,https://github.com/norvig/pytudes,,,,norvig/pytudes,pytudes,19160,2226,708,"['python', 'python-3', 'programming', 'practice', 'demonstrate-skills']",Jupyter Notebook,,"pytudes: Python programs, usually short, of considerable difficulty, to perfect particular skills.",norvig,2022-09-14,2022-08-01,2017-03-01,289,66.26482213438736
257,crypto,https://github.com/freqtrade/freqtrade,,,,freqtrade/freqtrade,freqtrade,19154,4046,588,"['python', 'cryptocurrencies', 'trading-bot', 'telegram-bot', 'bitcoin', 'trade', 'cryptocurrency', 'algorithmic-trading', 'freqtrade']",Python,https://www.freqtrade.io,"freqtrade: Free, open source crypto trading bot",freqtrade,2022-09-15,2022-09-14,2017-05-17,278,68.86389316897791
352,ml-dl,https://github.com/paddlepaddle/paddle,,,,paddlepaddle/paddle,Paddle,18855,4704,733,"['paddlepaddle', 'deep-learning', 'scalability', 'machine-learning', 'neural-network', 'python', 'efficiency', 'distributed-training']",Python,http://www.paddlepaddle.org/,Paddle: PArallel Distributed Deep LEarning: Machine Learning Framework from Industrial Practice （『飞桨』核心框架，深度学习&机器学习高性能单机、分布式训练和跨平台部署）,paddlepaddle,2022-09-15,2022-09-15,2016-08-15,317,59.3991899189919
411,perf,https://github.com/google/flatbuffers,,,,google/flatbuffers,flatbuffers,18730,2898,639,"['flatbuffers', 'serialization', 'serialization-library', 'json-parser', 'marshalling', 'rpc', 'zero-copy', 'mmap', 'cross-platform', 'c-plus-plus', 'java', 'c-sharp', 'go', 'python', 'rust', 'javascript', 'typescript', 'grpc', 'c', 'protobuf']",C++,http://google.github.io/flatbuffers/,FlatBuffers: Memory Efficient Serialization Library,google,2022-09-15,2022-09-15,2014-05-19,434,43.11410720157843
275,ml,https://github.com/google/mediapipe,,,,google/mediapipe,mediapipe,18679,3940,486,"['mediapipe', 'c-plus-plus', 'computer-vision', 'deep-learning', 'android', 'video-processing', 'audio-processing', 'mobile-development', 'machine-learning', 'inference', 'graph-framework', 'graph-based', 'calculator', 'framework', 'pipeline-framework', 'stream-processing', 'perception']",C++,https://mediapipe.dev,"mediapipe: Cross-platform, customizable ML solutions for live and streaming media.",google,2022-09-15,2022-09-09,2019-06-13,170,109.87647058823529
234,template,https://github.com/cookiecutter/cookiecutter,,,,cookiecutter/cookiecutter,cookiecutter,17978,1720,241,"['python', 'cookiecutter']",Python,https://pypi.org/project/cookiecutter/,"cookiecutter: A cross-platform command-line utility that creates projects from cookiecutters (project templates), e.g. Python package projects, C projects.",cookiecutter,2022-09-14,2022-09-09,2013-07-14,478,37.56597014925373
189,ml-interpretability,https://github.com/slundberg/shap,,,,slundberg/shap,shap,17444,2644,256,"['interpretability', 'machine-learning', 'deep-learning', 'gradient-boosting', 'shap', 'shapley', 'explainability']",Jupyter Notebook,,shap: A game theoretic approach to explain the output of any machine learning model.,slundberg,2022-09-15,2022-06-16,2016-11-22,303,57.51672162034856
61,viz,https://github.com/plotly/dash,,,,plotly/dash,dash,17323,1764,406,"['dash', 'plotly', 'data-visualization', 'data-science', 'gui-framework', 'flask', 'react', 'python', 'finance', 'bioinformatics', 'technical-computing', 'charting', 'plotly-dash', 'web-app', 'productivity', 'modeling', 'r', 'rstats', 'jupyter', 'julia']",Python,https://plotly.com/dash,"dash: Analytical Web Apps for Python, R, Julia, and Jupyter. No JavaScript Required.",plotly,2022-09-15,2022-09-12,2015-04-10,387,44.66335174953959
188,ml,https://github.com/harisiqbal88/plotneuralnet,,,,harisiqbal88/plotneuralnet,PlotNeuralNet,17281,2397,208,"['latex', 'deep-neural-networks']",TeX,,PlotNeuralNet: Latex code for making neural networks diagrams,harisiqbal88,2022-09-14,2020-11-06,2018-07-24,216,79.89894319682959
6,viz,https://github.com/bokeh/bokeh,,,,bokeh/bokeh,bokeh,16676,3977,451,"['bokeh', 'python', 'interactive-plots', 'javascript', 'visualization', 'plotting', 'plots', 'data-visualisation', 'notebooks', 'jupyter', 'visualisation', 'numfocus']",Python,https://bokeh.org,"bokeh: Interactive Data Visualization in the browser, from  Python",bokeh,2022-09-14,2022-09-14,2012-03-26,546,30.51816993464052
30,web,https://github.com/huge-success/sanic,,,,huge-success/sanic,sanic,16458,1467,415,"['python', 'framework', 'asyncio', 'api-server', 'web', 'web-server', 'web-framework', 'asgi', 'sanic']",Python,https://sanic.dev,sanic: Next generation Python web server/framework | Build fast. Run fast.,huge-success,2022-09-15,2022-09-13,2016-05-26,329,50.02431610942249
107,sim,https://github.com/atsushisakai/pythonrobotics,,,,atsushisakai/pythonrobotics,PythonRobotics,16201,5183,497,"['python', 'robotics', 'algorithm', 'path-planning', 'control', 'animation', 'localization', 'slam', 'cvxpy', 'ekf', 'autonomous-vehicles', 'autonomous-driving', 'mapping', 'autonomous-navigation', 'robot', 'hacktoberfest']",Python,https://atsushisakai.github.io/PythonRobotics/,PythonRobotics: Python sample codes for robotics algorithms.,atsushisakai,2022-09-15,2022-09-12,2016-03-21,338,47.871253693541576
48,viz,https://github.com/matplotlib/matplotlib,,,,matplotlib/matplotlib,matplotlib,16114,6485,582,"['matplotlib', 'data-visualization', 'data-science', 'python', 'qt', 'wx', 'gtk', 'plotting', 'tk', 'hacktoberfest']",Python,https://matplotlib.org/stable,matplotlib: plotting with Python,matplotlib,2022-09-15,2022-09-13,2011-02-19,603,26.691433980123048
351,ml,https://github.com/jina-ai/jina,,,,jina-ai/jina,jina,16006,1963,181,"['neural-search', 'cloud-native', 'deep-learning', 'machine-learning', 'framework', 'vector-search-engine', 'grpc', 'kubernetes', 'microservices', 'semantic-search', 'multimodal', 'crossmodal', 'creative-ai', 'aiops', 'mlops', 'pipeline', 'workflow', 'airflow', 'fastapi']",Python,https://docs.jina.ai,jina: 🔮 Build cross-modal and multimodal applications on the cloud · Neural Search · Creative AI · Cloud Native · MLOps ,jina-ai,2022-09-15,2022-09-14,2020-02-13,135,118.56296296296296
102,ml-ops,https://github.com/spotify/luigi,,,,spotify/luigi,luigi,15963,2348,486,"['python', 'luigi', 'orchestration-framework', 'scheduling', 'hadoop']",Python,,"Luigi is a Python module that helps you build complex pipelines of batch jobs. It handles dependency resolution, workflow management, visualization etc. It also comes with Hadoop support built in. ",spotify,2022-09-14,2022-09-12,2012-09-20,521,30.63915547024952
428,study,https://github.com/fchollet/deep-learning-with-python-notebooks,,,,fchollet/deep-learning-with-python-notebooks,deep-learning-with-python-notebooks,15849,7741,642,[],Jupyter Notebook,,"deep-learning-with-python-notebooks: Jupyter notebooks for the code samples of the book ""Deep Learning with Python""",fchollet,2022-09-15,2022-02-10,2017-09-05,262,60.4264705882353
