,category,githuburl,featured,links,description,_repopath,_reponame,_stars,_forks,_watches,_topics,_language,_homepage,_description,_organization,_updated_at,_last_commit_date,_created_at
67,web,https://github.com/pyeve/eve,,,,pyeve/eve,eve,6246,727,235,"['python', 'rest', 'flask', 'mongodb']",Python,https://python-eve.org,REST API framework designed for human beings,pyeve,2020-12-09,2020-12-05,2012-10-22
129,viz,https://github.com/altair-viz/altair,,,,altair-viz/altair,altair,6227,567,148,[],Python,https://altair-viz.github.io/,Declarative statistical visualization library for Python,altair-viz,2020-12-09,2020-12-01,2015-09-19
7,util,https://github.com/boto/boto3,,,,boto/boto3,boto3,5978,1288,237,"['python', 'aws', 'cloud', 'cloud-management', 'aws-sdk']",Python,http://aws.amazon.com/sdk-for-python/,AWS SDK for Python,boto,2020-12-10,2020-12-09,2014-10-03
53,perf,https://github.com/numba/numba,,,,numba/numba,numba,5868,738,214,"['python', 'numpy', 'llvm', 'compiler', 'cuda', 'rocm', 'parallel']",Python,http://numba.pydata.org/,NumPy aware dynamic Python compiler using LLVM,numba,2020-12-10,2020-12-04,2012-03-08
84,ml,https://github.com/statsmodels/statsmodels,,,,statsmodels/statsmodels,statsmodels,5791,2120,269,"['python', 'statistics', 'econometrics', 'data-analysis', 'generalized-linear-models', 'timeseries-analysis', 'regression-models']",Python,http://www.statsmodels.org/devel/,Statsmodels: statistical modeling and econometrics in Python,statsmodels,2020-12-10,2020-12-07,2011-06-12
138,nlp,https://github.com/huggingface/datasets,,,,huggingface/datasets,datasets,5709,577,194,"['nlp', 'datasets', 'metrics', 'evaluation', 'pytorch', 'tensorflow', 'pandas', 'numpy', 'natural-language-processing']",Python,https://huggingface.co/docs/datasets,"ðŸ¤— Fast, efficient, open-access datasets and evaluation metrics in PyTorch, TensorFlow, NumPy and Pandas",huggingface,2020-12-10,2020-12-09,2020-03-26
10,util,https://github.com/cython/cython,,,,cython/cython,cython,5698,1109,226,"['python', 'cython', 'cpython', 'cpython-extensions', 'c', 'cpp', 'performance', 'big-data']",Python,https://cython.org,The most widely used Python to C compiler,cython,2020-12-09,2020-12-06,2010-11-21
151,ml,https://github.com/catboost/catboost,,,,catboost/catboost,catboost,5577,850,200,"['machine-learning', 'decision-trees', 'gradient-boosting', 'gbm', 'gbdt', 'python', 'r', 'kaggle', 'gpu-computing', 'catboost', 'tutorial', 'categorical-features', 'gpu', 'coreml', 'data-science', 'big-data', 'cuda', 'data-mining']",C++,https://catboost.ai,"A fast, scalable, high performance Gradient Boosting on Decision Trees library, used for ranking, classification, regression and other machine learning tasks for Python, R, Java, C++. Supports computation on CPU and GPU.",catboost,2020-12-10,2020-12-10,2017-07-18
120,pipeline,https://github.com/PrefectHQ/prefect,,,,PrefectHQ/prefect,prefect,5514,455,140,"['python', 'workflow', 'data-engineering', 'data-science', 'workflow-engine', 'prefect', 'infrastructure', 'ml-ops', 'data-ops', 'automation']",Python,https://prefect.io,The easiest way to automate your data,PrefectHQ,2020-12-10,2020-12-09,2018-06-29
125,perf,https://github.com/modin-project/modin,,,,modin-project/modin,modin,5513,380,103,"['dataframe', 'pandas', 'ray', 'distributed', 'datascience', 'pandas-on-ray', 'modin', 'sql', 'python']",Python,http://modin.readthedocs.io,Modin: Speed up your Pandas workflows by changing a single line of code,modin-project,2020-12-10,2020-12-09,2018-06-21
95,perf,https://github.com/vaexio/vaex,,,,vaexio/vaex,vaex,5445,419,140,"['dataframe', 'python', 'bigdata', 'tabular-data', 'visualization', 'memory-mapped-file', 'hdf5', 'machine-learning', 'machinelearning']",Python,https://vaex.io," Out-of-Core DataFrames for Python, ML, visualize and explore big tabular data at a billion rows per second ðŸš€",vaexio,2020-12-10,2020-12-09,2014-09-27
70,ml,https://github.com/pymc-devs/pymc3,,,,pymc-devs/pymc3,pymc3,5419,1318,251,"['python', 'statistical-analysis', 'bayesian-inference', 'mcmc', 'variational-inference', 'theano', 'probabilistic-programming']",Python,https://docs.pymc.io/,Probabilistic Programming in Python: Bayesian Modeling and Probabilistic Machine Learning with Theano,pymc-devs,2020-12-09,2020-12-08,2009-05-05
28,ml,https://github.com/google/trax,,,,google/trax,trax,5378,500,130,"['jax', 'numpy', 'deep-learning', 'deep-reinforcement-learning', 'machine-learning', 'transformer', 'reinforcement-learning']",Python,,Trax â€” Deep Learning with Clear Code and Speed,google,2020-12-09,2020-12-09,2019-10-05
142,ml,https://github.com/FeatureLabs/featuretools,1.0,,,FeatureLabs/featuretools,featuretools,5262,681,153,"['feature-engineering', 'machine-learning', 'data-science', 'automated-machine-learning', 'automl', 'python', 'scikit-learn', 'automated-feature-engineering']",Python,https://www.featuretools.com,An open source python library for automated feature engineering,FeatureLabs,2020-12-09,2020-12-08,2017-09-08
134,ml,https://github.com/hyperopt/hyperopt,,,,hyperopt/hyperopt,hyperopt,5247,848,127,[],Python,http://hyperopt.github.io/hyperopt,Distributed Asynchronous Hyperparameter Optimization in Python,hyperopt,2020-12-10,2020-11-18,2011-09-06
154,util,https://github.com/marshmallow-code/marshmallow,,,,marshmallow-code/marshmallow,marshmallow,5149,539,85,"['serialization', 'deserialization', 'validation', 'python', 'marshalling', 'python-3', 'serde', 'schema', 'hacktoberfest']",Python,https://marshmallow.readthedocs.io/,A lightweight library for converting complex objects to and from simple Python datatypes.,marshmallow-code,2020-12-09,2020-12-08,2013-11-10
20,typing,https://github.com/facebook/pyre-check,,,,facebook/pyre-check,pyre-check,5076,298,106,"['python', 'typechecker', 'type-check', 'static-analysis', 'ocaml', 'code-quality', 'abstract-interpretation', 'security', 'program-analysis', 'taint-analysis', 'control-flow-analysis']",OCaml,https://pyre-check.org/,Performant type-checking for python.,facebook,2020-12-10,2020-12-10,2017-11-10
132,ml,https://github.com/automl/auto-sklearn,,,,automl/auto-sklearn,auto-sklearn,5051,961,219,"['automl', 'scikit-learn', 'automated-machine-learning', 'hyperparameter-optimization', 'hyperparameter-tuning', 'hyperparameter-search', 'bayesian-optimization', 'metalearning', 'meta-learning', 'smac']",Python,https://automl.github.io/auto-sklearn,Automated Machine Learning with scikit-learn,automl,2020-12-10,2020-12-07,2015-07-02
73,viz,https://github.com/python-visualization/folium,,,,python-visualization/folium,folium,5031,1876,171,[],Python,https://python-visualization.github.io/folium/,Python Data. Leaflet.js Maps. ,python-visualization,2020-12-09,2020-11-29,2013-05-09
96,data,https://github.com/vi3k6i5/flashtext,,,,vi3k6i5/flashtext,flashtext,4577,527,143,"['search-in-text', 'keyword-extraction', 'nlp', 'word2vec', 'data-extraction']",Python,,Extract Keywords from sentence or Replace keywords in sentences.,vi3k6i5,2020-12-09,2020-05-03,2017-08-15
106,ml,https://github.com/NicolasHug/Surprise,,,,NicolasHug/Surprise,Surprise,4554,817,153,"['recommender', 'systems', 'recommendation', 'svd', 'matrix', 'factorization']",Python,http://surpriselib.com,A Python scikit for building and analyzing recommender systems,NicolasHug,2020-12-10,2020-08-05,2016-10-23
44,ml,https://github.com/lmcinnes/umap,,,,lmcinnes/umap,umap,4313,461,120,"['umap', 'dimensionality-reduction', 'visualization', 'machine-learning', 'topological-data-analysis']",Python,,Uniform Manifold Approximation and Projection,lmcinnes,2020-12-09,2020-11-26,2017-07-02
171,nlp,https://github.com/minimaxir/textgenrnn,,,,minimaxir/textgenrnn,textgenrnn,4174,664,145,"['keras', 'deep-learning', 'text-generation', 'tensorflow', 'python']",Python,,Easily train your own text-generating neural network of any size and complexity on any text dataset with a few lines of code.,minimaxir,2020-12-09,2020-07-14,2017-08-07
173,ml,https://github.com/facebookresearch/pytorch3d,,,,facebookresearch/pytorch3d,pytorch3d,4082,453,123,[],Python,https://pytorch3d.org/,PyTorch3D is FAIR's library of reusable components for deep learning with 3D data,facebookresearch,2020-12-10,2020-12-09,2019-10-25
21,nlp,https://github.com/facebookresearch/DrQA,,,,facebookresearch/DrQA,DrQA,3948,837,170,[],Python,,Reading Wikipedia to Answer Open-Domain Questions,facebookresearch,2020-12-09,2020-09-24,2017-07-07
69,util,https://github.com/PyGithub/PyGithub,,,,PyGithub/PyGithub,PyGithub,3933,1230,103,"['pygithub', 'python', 'github', 'github-api']",Python,https://pygithub.readthedocs.io/,Typed interactions with the GitHub API v3,PyGithub,2020-12-09,2020-12-03,2012-02-25
167,nlp,https://github.com/doccano/doccano,,,,doccano/doccano,doccano,3924,841,99,"['natural-language-processing', 'machine-learning', 'active-learning', 'annotation-tool', 'python', 'datasets', 'dataset', 'data-labeling', 'text-annotation']",Python,https://doccano.herokuapp.com,Open source text annotation tool for machine learning practitioner.,doccano,2020-12-10,2020-12-10,2018-05-09
127,ml,https://github.com/microsoft/DeepSpeed,,,,microsoft/DeepSpeed,DeepSpeed,3809,347,92,"['deep-learning', 'pytorch', 'gpu', 'machine-learning', 'billion-parameters', 'data-parallelism', 'model-parallelism']",Python,https://www.deepspeed.ai/,"DeepSpeed is a deep learning optimization library that makes distributed training easy, efficient, and effective.",microsoft,2020-12-10,2020-12-09,2020-01-23
143,nlp,https://github.com/UKPLab/sentence-transformers,,,,UKPLab/sentence-transformers,sentence-transformers,3649,689,86,[],Python,,Sentence Embeddings with BERT & XLNet,UKPLab,2020-12-10,2020-12-07,2019-07-24
81,util,https://github.com/sphinx-doc/sphinx,,,,sphinx-doc/sphinx,sphinx,3646,1380,129,"['python', 'documentation', 'documentation-tool', 'sphinx']",Python,https://www.sphinx-doc.org,Main repository for the Sphinx documentation builder,sphinx-doc,2020-12-09,2020-12-08,2015-01-02
15,ml,https://github.com/dnouri/skorch,,,,dnouri/skorch,skorch,3643,275,82,"['scikit-learn', 'pytorch', 'machine-learning']",Python,,A scikit-learn compatible neural network library that wraps PyTorch,dnouri,2020-12-10,2020-12-09,2017-07-18
101,ml,https://github.com/rasbt/mlxtend,,,,rasbt/mlxtend,mlxtend,3238,687,123,"['python', 'machine-learning', 'data-science', 'data-mining', 'association-rules', 'supervised-learning', 'unsupervised-learning']",Python,http://rasbt.github.io/mlxtend/,A library of extension and helper modules for Python's data analysis and machine learning libraries.,rasbt,2020-12-10,2020-12-03,2014-08-14
29,data,https://github.com/great-expectations/great_expectations,,,,great-expectations/great_expectations,great_expectations,3225,356,58,"['pipeline-tests', 'dataquality', 'datacleaning', 'datacleaner', 'data-science', 'data-profiling', 'pipeline', 'pipeline-testing', 'cleandata', 'dataunittest', 'data-unit-tests', 'eda', 'exploratory-data-analysis', 'exploratory-analysis', 'exploratorydataanalysis', 'data-quality', 'data-engineering', 'pipeline-debt', 'data-profilers', 'mlops']",Python,https://docs.greatexpectations.io/,Always know what to expect from your data.,great-expectations,2020-12-10,2020-12-10,2017-09-11
116,pipeline,https://github.com/quantumblacklabs/kedro,,,,quantumblacklabs/kedro,kedro,3210,378,85,"['data-abstraction', 'pipeline', 'pipelines-as-code', 'kedro', 'cookiecutter-data-science', 'hacktoberfest', 'data-versioning', 'mlops']",Python,https://kedro.readthedocs.io/,"A Python library that helps you create reproducible, maintainable and modular data science code. ",quantumblacklabs,2020-12-10,2020-12-08,2019-04-18
43,data,https://github.com/lk-geimfari/mimesis,,,,lk-geimfari/mimesis,mimesis,3164,269,67,"['mimesis', 'fake', 'data', 'generator', 'fixtures', 'dummy', 'synthetic', 'json', 'schema', 'testing', 'python', 'json-generator', 'faker', 'e2e', 'mock', 'fake-api']",Python,https://mimesis.name/,"Mimesis is a high-performance fake data generator for Python, which provides data for a variety of purposes in a variety of languages.",lk-geimfari,2020-12-09,2020-12-06,2016-09-09
66,util,https://github.com/PyCQA/pylint,,,,PyCQA/pylint,pylint,3107,652,69,"['static-analysis', 'linter', 'static-code-analysis', 'code-quality', 'pep8']",Python,http://pylint.pycqa.org,It's not just a linter that annoys you!,PyCQA,2020-12-10,2020-11-30,2015-12-09
175,util,https://github.com/tiangolo/typer,1.0,,,tiangolo/typer,typer,3107,113,45,"['cli', 'click', 'python3', 'typehints', 'terminal', 'shell', 'python', 'typer']",Python,https://typer.tiangolo.com/,"Typer, build great CLIs. Easy to code. Based on Python type hints.",tiangolo,2020-12-10,2020-08-16,2019-12-24
82,data,https://github.com/sqlalchemy/sqlalchemy,,,,sqlalchemy/sqlalchemy,sqlalchemy,3054,484,66,"['sqlalchemy', 'sql', 'python']",Python,https://www.sqlalchemy.org,The Database Toolkit for Python,sqlalchemy,2020-12-10,2020-12-09,2018-11-27
13,ml,https://github.com/DistrictDataLabs/yellowbrick,,,,DistrictDataLabs/yellowbrick,yellowbrick,3030,469,102,"['machine-learning', 'visual-analysis', 'model-selection', 'visualization', 'scikit-learn', 'visualizer', 'matplotlib', 'python', 'estimator', 'anaconda']",Python,http://www.scikit-yb.org/,Visual analysis and diagnostic tools to facilitate machine learning model selection.,DistrictDataLabs,2020-12-09,2020-11-01,2016-05-18
27,typing,https://github.com/google/pytype,,,,google/pytype,pytype,3012,172,64,"['python', 'typing', 'typechecker', 'linter', 'types', 'static-analysis', 'static-code-analysis']",Python,https://google.github.io/pytype,A static type analyzer for Python code,google,2020-12-09,2020-12-09,2015-03-18
93,web,https://github.com/unbit/uwsgi,,,,unbit/uwsgi,uwsgi,2895,611,117,[],C,http://projects.unbit.it/uwsgi,uWSGI application server container,unbit,2020-12-09,2020-11-29,2011-10-09
68,gamedev,https://github.com/pygame/pygame,,,,pygame/pygame,pygame,2887,1204,128,"['python', 'pygame', 'sdl2', 'sdl', 'game-development', 'gamedev', 'game-dev']",C,https://www.pygame.org,"pygame (the library) is a Free and Open Source python programming language library for making multimedia applications like games built on top of the excellent SDL library. C, Python, Native, OpenGL.",pygame,2020-12-10,2020-12-10,2017-03-26
97,viz,https://github.com/voila-dashboards/voila,,,,voila-dashboards/voila,voila,2869,266,73,[],Python,,VoilÃ  turns Jupyter notebooks into standalone web applications,voila-dashboards,2020-12-10,2020-11-19,2018-08-21
3,ml,https://github.com/awslabs/autogluon,,,,awslabs/autogluon,autogluon,2799,364,76,"['automl', 'machine-learning', 'data-science', 'deep-learning', 'ensemble-learning', 'image-classification', 'computer-vision', 'natural-language-processing', 'structured-data', 'object-detection', 'gluon', 'mxnet', 'transfer-learning', 'pytorch', 'automated-machine-learning', 'scikit-learn', 'autogluon', 'tabular-data', 'neural-architecture-search', 'hyperparameter-optimization']",Python,https://auto.gluon.ai/,"AutoGluon: AutoML for Text, Image, and Tabular Data",awslabs,2020-12-10,2020-12-10,2019-07-29
65,ml,https://github.com/pycaret/pycaret,,,,pycaret/pycaret,pycaret,2635,554,89,"['data-science', 'citizen-data-scientists', 'python', 'machine-learning', 'pycaret', 'ml', 'gpu']",Jupyter Notebook,https://www.pycaret.org,"An open-source, low-code machine learning library in Python",pycaret,2020-12-10,2020-12-09,2019-11-23
140,viz,https://github.com/vispy/vispy,,,,vispy/vispy,vispy,2523,537,138,"['hacktoberfest', 'python', 'opengl', 'visualization']",Python,http://vispy.org,Main repository for Vispy,vispy,2020-12-09,2020-11-28,2013-03-21
58,gamedev,https://github.com/panda3d/panda3d,,,,panda3d/panda3d,panda3d,2520,588,193,"['game-engine', 'open-source', 'panda3d', 'cross-platform', 'python', 'panda3d-game-engine', 'game-development', 'opengl', 'multi-platform', 'gamedev', 'c-plus-plus']",C++,https://www.panda3d.org/,"Powerful, mature open-source cross-platform game engine for Python and C++, developed by Disney and CMU",panda3d,2020-12-09,2020-12-09,2013-09-30
77,data,https://github.com/quantopian/qgrid,,,,quantopian/qgrid,qgrid,2463,303,94,[],Python,,"An interactive grid for sorting, filtering, and editing DataFrames in Jupyter notebooks",quantopian,2020-12-09,2020-04-07,2014-09-30
163,ml,https://github.com/wandb/client,,,,wandb/client,client,2463,167,29,"['machine-learning', 'experiment-track', 'deep-learning', 'keras', 'tensorflow', 'pytorch', 'hyperparameter-search', 'reinforcement-learning']",Python,http://wandb.com,ðŸ”¥ A tool for visualizing and tracking your machine learning experiments. This repo contains the CLI and Python API.,wandb,2020-12-09,2020-12-09,2017-03-24
121,pipeline,https://github.com/dagster-io/dagster,,,,dagster-io/dagster,dagster,2408,247,57,"['data-pipelines', 'dagster', 'workflow', 'data-science', 'workflow-automation', 'python', 'scheduler', 'hacktoberfest']",Python,https://dagster.io,"A data orchestrator for machine learning, analytics, and ETL.",dagster-io,2020-12-09,2020-12-09,2018-04-30
35,data,https://github.com/jmcnamara/XlsxWriter,,,,jmcnamara/XlsxWriter,XlsxWriter,2407,506,121,"['python', 'xlsx-files', 'libxlsxwriter', 'pandas', 'charts', 'spreadsheet', 'xlsx', 'xlsxwriter']",Python,https://xlsxwriter.readthedocs.io,A Python module for creating Excel XLSX files.,jmcnamara,2020-12-06,2020-10-13,2013-01-04
0,data,https://github.com/andialbrecht/sqlparse,,,,andialbrecht/sqlparse,sqlparse,2268,473,91,[],Python,,A non-validating SQL parser module for Python,andialbrecht,2020-12-10,2020-10-19,2012-04-18
139,nlp,https://github.com/pair-code/lit,,,,pair-code/lit,lit,2267,218,77,"['machine-learning', 'natural-language-processing', 'visualization']",TypeScript,https://pair-code.github.io/lit,The Language Interpretability Tool: Interactively analyze NLP models for model understanding in an extensible and framework agnostic interface.,pair-code,2020-12-09,2020-11-17,2020-07-28
111,ml,https://github.com/TeamHG-Memex/eli5,,,,TeamHG-Memex/eli5,eli5,2219,292,71,"['scikit-learn', 'machine-learning', 'xgboost', 'lightgbm', 'crfsuite', 'inspection', 'explanation', 'nlp', 'data-science', 'python']",Jupyter Notebook,http://eli5.readthedocs.io,A library for debugging/inspecting machine learning classifiers and explaining their predictions,TeamHG-Memex,2020-12-09,2020-01-22,2016-09-15
161,data,https://github.com/goldsmith/Wikipedia,,,,goldsmith/Wikipedia,Wikipedia,2152,432,72,[],Python,https://wikipedia.readthedocs.org/,A Pythonic wrapper for the Wikipedia API,goldsmith,2020-12-09,2020-10-09,2013-08-20
113,nlp,https://github.com/huggingface/neuralcoref,,,,huggingface/neuralcoref,neuralcoref,2134,375,69,"['python', 'machine-learning', 'coreference', 'spacy', 'coreference-resolution', 'spacy-extension', 'spacy-pipeline', 'nlp', 'neural-networks', 'pytorch']",Python,https://huggingface.co/coref/,âœ¨Fast Coreference Resolution in spaCy with Neural Networks,huggingface,2020-12-09,2020-09-07,2017-07-03
131,ml,https://github.com/explosion/thinc,,,,explosion/thinc,thinc,2115,194,80,"['machine-learning', 'deep-learning', 'artificial-intelligence', 'ai', 'python', 'nlp', 'natural-language-processing', 'spacy', 'machine-learning-library', 'type-checking', 'functional-programming', 'pytorch', 'tensorflow', 'mxnet', 'jax']",Python,https://thinc.ai,"ðŸ”® A refreshing functional take on deep learning, compatible with your favorite libraries",explosion,2020-12-08,2020-12-08,2014-10-16
94,util,https://github.com/urwid/urwid,,,,urwid/urwid,urwid,2060,268,59,[],Python,urwid.org,Console user interface library for Python (official repo),urwid,2020-12-10,2020-09-26,2010-02-25
34,nlp,https://github.com/jbesomi/texthero,,,,jbesomi/texthero,texthero,2001,178,41,"['text-preprocessing', 'text-representation', 'text-visualization', 'nlp', 'word-embeddings', 'machine-learning', 'text-mining', 'nlp-pipeline', 'text-clustering', 'texthero']",Python,https://texthero.org,"Text preprocessing, representation and visualization from zero to hero.",jbesomi,2020-12-10,2020-11-03,2020-04-06
98,data,https://github.com/ZoomerAnalytics/xlwings,,,,ZoomerAnalytics/xlwings,xlwings,1851,344,137,"['python', 'excel', 'reporting', 'automation']",Python,https://www.xlwings.org,xlwings is a BSD-licensed Python library that makes it easy to call Python from Excel and vice versa. It works with Microsoft Excel on Windows and macOS. Sign up for the newsletter or follow us on twitter via,ZoomerAnalytics,2020-12-10,2020-12-04,2014-03-17
155,viz,https://github.com/adamerose/pandasgui,,,,adamerose/pandasgui,PandasGUI,1846,103,50,"['pandas', 'dataframe', 'gui', 'viewer']",Python,,A GUI for Pandas DataFrames,adamerose,2020-12-09,2020-12-05,2019-06-12
42,nlp,https://github.com/life4/textdistance,,,,life4/textdistance,textdistance,1832,158,52,"['distance', 'algorithm', 'python', 'textdistance', 'hamming-distance', 'levenshtein-distance', 'damerau-levenshtein', 'damerau-levenshtein-distance', 'algorithms', 'distance-calculation', 'jellyfish', 'diff', 'levenshtein']",Python,,"Compute distance between sequences. 30+ algorithms, pure python implementation, common interface, optional external libs usage.",life4,2020-12-08,2020-04-13,2017-05-05
130,viz,https://github.com/holoviz/holoviews,,,,holoviz/holoviews,holoviews,1757,294,62,"['holoviz', 'holoviews', 'plotting']",Python,https://holoviews.org,"With Holoviews, your data visualizes itself.",holoviz,2020-12-10,2020-12-09,2014-05-07
176,util,https://github.com/liiight/notifiers,,,,liiight/notifiers,notifiers,1739,69,37,"['python', 'notifications', 'notifier', 'notification-service', 'python3']",Python,http://notifiers.readthedocs.io/,The easy way to send notifications,liiight,2020-12-09,2020-11-05,2017-06-01
85,graph,https://github.com/stellargraph/stellargraph,,,,stellargraph/stellargraph,stellargraph,1668,245,56,"['graphs', 'machine-learning', 'machine-learning-algorithms', 'graph-convolutional-networks', 'networkx', 'geometric-deep-learning', 'saliency-map', 'interpretability', 'heterogeneous-networks', 'graph-neural-networks', 'graph-analysis']",Python,https://stellargraph.io/,StellarGraph - Machine Learning on Graphs,stellargraph,2020-12-09,2020-07-21,2018-04-13
99,ml,https://github.com/skvark/opencv-python,,,,skvark/opencv-python,opencv-python,1620,296,55,"['opencv', 'python', 'wheel', 'python-3', 'opencv-python', 'opencv-contrib-python', 'precompiled', 'pypi', 'manylinux']",Shell,https://pypi.org/project/opencv-python/,"Automated CI toolchain to produce precompiled opencv-python, opencv-python-headless, opencv-contrib-python and opencv-contrib-python-headless packages.",skvark,2020-12-09,2020-11-28,2016-04-08
9,ml,https://github.com/ContextLab/hypertools,,,,ContextLab/hypertools,hypertools,1600,152,57,"['data-visualization', 'high-dimensional-data', 'python', 'topic-modeling', 'text-vectorization', 'data-wrangling', 'visualization', 'time-series']",Python,http://hypertools.readthedocs.io/en/latest/,A Python toolbox for gaining geometric insights into high-dimensional data,ContextLab,2020-12-09,2020-10-02,2016-09-27
174,viz,https://github.com/facebookresearch/hiplot,,,,facebookresearch/hiplot,hiplot,1479,81,24,[],TypeScript,https://facebookresearch.github.io/hiplot/,HiPlot makes understanding high dimensional data easy,facebookresearch,2020-12-09,2020-11-30,2019-11-08
46,viz,https://github.com/maartenbreddels/ipyvolume,,,,maartenbreddels/ipyvolume,ipyvolume,1475,200,54,"['ipython-widget', 'jupyter', 'jupyter-notebook', 'python', 'visualisation', 'volume-rendering', 'virtual-reality', 'plotting', 'dataviz', 'scientific-visualization', 'webgl', 'threejs', 'rendering-3d-volumes', 'quiver']",Python,,3d plotting for Python in the Jupyter notebook based on IPython widgets using WebGL,maartenbreddels,2020-12-10,2020-12-08,2016-12-21
91,ml,https://github.com/uber/causalml,,,,uber/causalml,causalml,1475,224,51,"['incubation', 'machine-learning', 'causal-inference', 'uplift-modeling']",Python,,Uplift modeling and causal inference with machine learning algorithms,uber,2020-12-09,2020-12-08,2019-07-09
115,perf,https://github.com/h5py/h5py,,,,h5py/h5py,h5py,1450,395,54,[],Python,http://www.h5py.org,HDF5 for Python -- The h5py package is a Pythonic interface to the HDF5 binary data format.,h5py,2020-12-04,2020-12-01,2012-09-21
51,util,https://github.com/nedbat/coveragepy,,,,nedbat/coveragepy,coveragepy,1426,184,25,[],Python,,Code coverage measurement for Python,nedbat,2020-12-09,2020-12-08,2018-06-23
32,nlp,https://github.com/jamesturk/jellyfish,,,,jamesturk/jellyfish,jellyfish,1370,122,42,"['python', 'levenshtein', 'soundex', 'hamming', 'metaphone', 'jaro-winkler', 'fuzzy-search']",Python,,ðŸŽ a python library for doing approximate and phonetic matching of strings.,jamesturk,2020-12-08,2020-12-08,2010-07-09
144,nlp,https://github.com/plasticityai/magnitude,,,,plasticityai/magnitude,magnitude,1365,100,35,"['python', 'natural-language-processing', 'nlp', 'machine-learning', 'vectors', 'embeddings', 'word2vec', 'fasttext', 'glove', 'gensim', 'fast', 'memory-efficient', 'machine-learning-library', 'word-embeddings']",Python,,"A fast, efficient universal vector embedding utility package.",plasticityai,2020-12-09,2020-07-17,2018-02-24
4,data,https://github.com/awslabs/aws-data-wrangler,,,,awslabs/aws-data-wrangler,aws-data-wrangler,1258,208,58,"['python', 'aws', 'pandas', 'apache-arrow', 'apache-parquet', 'data-engineering', 'etl', 'data-science', 'redshift', 'athena', 'lambda', 'aws-lambda', 'aws-glue', 'emr', 'amazon-athena', 'glue-catalog', 'mysql', 'amazon-sagemaker-notebook']",Python,https://aws-data-wrangler.readthedocs.io,Pandas on AWS,awslabs,2020-12-09,2020-12-09,2019-02-26
146,ml,https://github.com/nmslib/hnswlib,,,,nmslib/hnswlib,hnswlib,1233,225,51,[],C++,https://github.com/nmslib/hnswlib,Header-only C++/python library for fast approximate nearest neighbors,nmslib,2020-12-09,2020-08-18,2017-07-06
