,category,githuburl,featured,links,description,_repopath,_reponame,_stars,_forks,_watches,_topics,_language,_homepage,_description,_organization,_updated_at,_last_commit_date,_created_at,_age_weeks,_stars_per_week
683,ml,https://github.com/hips/autograd,,,,hips/autograd,autograd,5967,831,217,[],Python,,autograd: Efficiently computes derivatives of numpy code.,hips,2022-09-15,2022-06-15,2014-11-24,407,14.645511921458626
73,geo,https://github.com/python-visualization/folium,,,,python-visualization/folium,folium,5887,2124,175,[],Python,https://python-visualization.github.io/folium/,folium: Python Data. Leaflet.js Maps. ,python-visualization,2022-09-14,2022-05-06,2013-05-09,488,12.063524590163935
44,ml,https://github.com/lmcinnes/umap,,,,lmcinnes/umap,umap,5774,663,125,"['umap', 'dimensionality-reduction', 'visualization', 'machine-learning', 'topological-data-analysis']",Python,,umap: Uniform Manifold Approximation and Projection,lmcinnes,2022-09-14,2022-09-14,2017-07-02,271,21.26144134665965
412,web,https://github.com/encode/uvicorn,,,,encode/uvicorn,uvicorn,5678,486,86,"['python', 'asyncio', 'asgi', 'http', 'http-server']",Python,https://www.uvicorn.org/,"uvicorn: An ASGI web server, for Python. 🦄",encode,2022-09-14,2022-09-14,2017-05-31,276,20.561821003621315
461,ml-ops,https://github.com/dbt-labs/dbt-core,,,,dbt-labs/dbt-core,dbt-core,5657,989,118,"['dbt-viewpoint', 'slack', 'pypa', 'data-modeling', 'business-intelligence', 'analytics', 'elt']",Python,https://getdbt.com,dbt-core: dbt enables data analysts and engineers to transform their data using the same practices that software engineers use to build applications.,dbt-labs,2022-09-15,2022-09-14,2016-03-10,340,16.638235294117646
601,geo,https://github.com/domlysz/blendergis,,,,domlysz/blendergis,BlenderGIS,5591,1030,240,"['blender', 'addon', 'geospatial', 'gis', 'shapefile', 'delaunay-triangulation', 'raster', 'openstreetmap', 'python', 'dem', '3dgis', 'map', 'geodata', 'georeferencing', 'importexport', '3d', 'terrain-model', 'basemap', '3d-map']",Python,,BlenderGIS: Blender addons to make the bridge between Blender and geographic data,domlysz,2022-09-15,2022-05-31,2014-05-08,436,12.823394495412844
732,ml,https://github.com/cleverhans-lab/cleverhans,,,,cleverhans-lab/cleverhans,cleverhans,5586,1373,190,"['machine-learning', 'security', 'benchmarking']",Jupyter Notebook,,"cleverhans: An adversarial example library for constructing attacks, building defenses, and benchmarking both",cleverhans-lab,2022-09-15,2021-09-23,2016-09-15,313,17.84664536741214
558,ml-dl,https://github.com/arogozhnikov/einops,,,,arogozhnikov/einops,einops,5585,250,56,"['deep-learning', 'pytorch', 'tensorflow', 'numpy', 'gluon', 'cupy', 'chainer', 'keras', 'tensor', 'jax']",Python,https://einops.rocks,"einops: Deep learning operations reinvented (for pytorch, tensorflow, jax and others)",arogozhnikov,2022-09-14,2022-09-06,2018-09-22,207,26.8878954607978
347,jupyter,https://github.com/mwouts/jupytext,,,,mwouts/jupytext,jupytext,5577,360,69,"['jupyter-notebook', 'jupyterlab-extension', 'version-control', 'knitr', 'rstudio', 'markdown', 'rmarkdown', 'python', 'hydrogen', 'notebooks', 'jupyterlab']",Python,https://jupytext.readthedocs.io,"jupytext: Jupyter Notebooks as Markdown Documents, Julia, Python or R scripts",mwouts,2022-09-13,2022-07-29,2018-06-15,221,25.13779781068899
106,ml,https://github.com/nicolashug/surprise,,,,nicolashug/surprise,Surprise,5520,946,149,"['recommender', 'systems', 'recommendation', 'svd', 'matrix', 'factorization', 'machine-learning']",Python,http://surpriselib.com,Surprise: A Python scikit for building and analyzing recommender systems,nicolashug,2022-09-14,2022-08-29,2016-10-23,307,17.94705062703205
315,util,https://github.com/pypa/pipx,,,,pypa/pipx,pipx,5488,252,65,"['pip', 'cli', 'pypi', 'venv']",Python,https://pypa.github.io/pipx/,pipx: Install and Run Python Applications in Isolated Environments,pypa,2022-09-14,2022-08-17,2018-10-06,205,26.677777777777777
69,util,https://github.com/pygithub/pygithub,,,,pygithub/pygithub,PyGithub,5480,1518,116,"['pygithub', 'python', 'github', 'github-api']",Python,https://pygithub.readthedocs.io/,PyGithub: Typed interactions with the GitHub API v3,pygithub,2022-09-15,2021-12-20,2012-02-25,550,9.95071335927367
539,nlp,https://github.com/espnet/espnet,,,,espnet/espnet,espnet,5466,1705,178,"['deep-learning', 'end-to-end', 'chainer', 'pytorch', 'kaldi', 'speech-recognition', 'speech-synthesis', 'speech-translation', 'machine-translation', 'voice-conversion', 'speech-enhancement', 'speech-separation']",Python,https://espnet.github.io/espnet/,espnet: End-to-End Speech Processing Toolkit,espnet,2022-09-14,2022-09-14,2017-12-13,248,22.02763385146805
121,ml-ops,https://github.com/dagster-io/dagster,,,,dagster-io/dagster,dagster,5416,678,87,"['data-pipelines', 'dagster', 'workflow', 'data-science', 'workflow-automation', 'python', 'scheduler', 'data-orchestrator', 'etl', 'analytics', 'data-engineering', 'mlops', 'orchestration', 'data-integration', 'metadata']",Python,https://dagster.io,"dagster: An orchestration platform for the development, production, and observation of data assets.",dagster-io,2022-09-15,2022-09-15,2018-04-30,228,23.709818636647906
384,ml-ops,https://github.com/deepset-ai/haystack,,,,deepset-ai/haystack,haystack,5413,869,89,"['nlp', 'question-answering', 'bert', 'transfer-learning', 'language-model', 'pytorch', 'semantic-search', 'neural-search', 'squad', 'elasticsearch', 'dpr', 'information-retrieval', 'summarization', 'search-engine', 'transformers', 'natural-language-processing', 'machine-learning', 'ai', 'python']",Python,https://deepset.ai/haystack,"haystack: :mag: Haystack is an open source NLP framework that leverages pre-trained Transformer models. It enables developers to quickly implement production-ready semantic search, question answering, summarization and document ranking for a wide range of NLP applications.",deepset-ai,2022-09-15,2022-09-13,2019-11-14,148,36.57432432432432
441,perf,https://github.com/mher/flower,,,,mher/flower,flower,5377,958,144,"['celery', 'task-queue', 'monitoring', 'administration', 'workers', 'rabbitmq', 'redis', 'python', 'asynchronous']",Python,https://flower.readthedocs.io,flower: Real-time monitor and web admin for Celery distributed task queue,mher,2022-09-14,2022-09-09,2012-07-08,531,10.11529158828272
645,util,https://github.com/theskumar/python-dotenv,,,,theskumar/python-dotenv,python-dotenv,5264,340,32,"['python', 'devops-tools', 'dotenv', '12-factor-app', 'configuration', 'env', 'environment-variables']",Python,https://saurabh-kumar.com/python-dotenv/,python-dotenv: Reads key-value pairs from a .env file and can set them as environment variables. It helps in developing applications following the 12-factor principles.,theskumar,2022-09-14,2022-09-03,2014-09-06,418,12.571818491982258
96,data,https://github.com/vi3k6i5/flashtext,,,,vi3k6i5/flashtext,flashtext,5258,597,139,"['search-in-text', 'keyword-extraction', 'nlp', 'word2vec', 'data-extraction']",Python,,flashtext: Extract Keywords from sentence or Replace keywords in sentences.,vi3k6i5,2022-09-14,2020-05-03,2017-08-15,265,19.82014001077006
68,gamedev,https://github.com/pygame/pygame,,,,pygame/pygame,pygame,5204,2270,161,"['python', 'pygame', 'sdl2', 'sdl', 'game-development', 'gamedev', 'game-dev']",C,https://www.pygame.org,"pygame: 🐍🎮 pygame (the library) is a Free and Open Source python programming language library for making multimedia applications like games built on top of the excellent SDL library. C, Python, Native, OpenGL.",pygame,2022-09-14,2022-09-13,2017-03-26,285,18.22311155577789
725,ml,https://github.com/py-why/dowhy,,,,py-why/dowhy,dowhy,5202,719,135,"['causal-inference', 'machine-learning', 'graphical-models', 'bayesian-networks', 'data-science', 'python3', 'causality', 'causal-models', 'treatment-effects', 'do-calculus', 'causal-machine-learning']",Python,https://py-why.github.io/dowhy/,"DoWhy is a Python library for causal inference that supports explicit modeling and testing of causal assumptions. DoWhy is based on a unified language for causal inference, combining causal graphical models and potential outcomes frameworks. ",py-why,2022-09-15,2022-09-14,2018-05-31,224,23.223214285714285
280,data,https://github.com/airbnb/knowledge-repo,,,,airbnb/knowledge-repo,knowledge-repo,5174,700,182,"['data', 'data-science', 'knowledge', 'data-analysis']",Python,,knowledge-repo: A next-generation curated knowledge sharing platform for data scientists and other technical professions.,airbnb,2022-09-13,2022-08-17,2016-08-17,317,16.314414414414415
195,util,https://github.com/pycqa/isort,,,,pycqa/isort,isort,5155,479,41,"['auto-formatter', 'isort', 'sorting-imports', 'python-utility', 'cli', 'linter', 'cleaner', 'formatter', 'python', 'python3', 'hacktoberfest']",Python,https://pycqa.github.io/isort/,isort: A Python utility / library to sort imports.,pycqa,2022-09-15,2022-05-20,2013-09-02,471,10.934848484848485
513,ml,https://github.com/google/automl,,,,google/automl,automl,5142,1366,151,"['automl', 'efficientdet', 'object-detection', 'efficientnet', 'efficientnetv2']",Jupyter Notebook,,automl: Google Brain AutoML,google,2022-09-15,2022-09-07,2020-03-12,131,39.25190839694657
581,ml,https://github.com/probml/pyprobml,,,,probml/pyprobml,pyprobml,5092,1203,173,"['jupyter-notebooks', 'machine-learning', 'colab', 'pml', 'probabilistic-programming', 'jax', 'tensorflow', 'pytorch', 'pymc3', 'numpyro', 'flax', 'pyro', 'blackjax']",Jupyter Notebook,,"pyprobml: Python code for ""Probabilistic Machine learning"" book by Kevin Murphy",probml,2022-09-14,2022-09-12,2016-08-17,317,16.055855855855857
436,util,https://github.com/scikit-image/scikit-image,,,,scikit-image/scikit-image,scikit-image,5038,2050,187,"['image-processing', 'python', 'computer-vision', 'hacktoberfest']",Python,https://scikit-image.org,scikit-image: Image processing in Python,scikit-image,2022-09-15,2022-09-14,2011-07-07,584,8.626712328767123
634,util,https://github.com/pyca/cryptography,,,,pyca/cryptography,cryptography,5028,1075,116,"['python', 'cryptography']",Python,https://cryptography.io,cryptography is a package designed to expose cryptographic primitives and recipes to Python developers.,pyca,2022-09-15,2022-09-15,2013-08-07,475,10.582080577269995
548,ml-dl,https://github.com/facebookresearch/mmf,,,,facebookresearch/mmf,mmf,5015,876,113,"['pytorch', 'vqa', 'pretrained-models', 'multimodal', 'deep-learning', 'captioning', 'dialog', 'textvqa', 'hateful-memes', 'multi-tasking']",Python,https://mmf.sh/,mmf: A modular framework for vision & language multimodal research from Facebook AI Research (FAIR),facebookresearch,2022-09-14,2022-08-11,2018-06-27,220,22.780661907852043
285,util,https://github.com/sdispater/pendulum,,,,sdispater/pendulum,pendulum,4991,302,60,"['python', 'datetime', 'date', 'time', 'python3', 'timezones']",Python,https://pendulum.eustace.io,pendulum: Python datetimes made easy,sdispater,2022-09-14,2022-08-24,2016-06-27,324,15.383971818582122
303,data,https://github.com/kaggle/kaggle-api,,,,kaggle/kaggle-api,kaggle-api,4943,956,185,[],Python,,kaggle-api: Official Kaggle API,kaggle,2022-09-15,2021-03-15,2018-01-25,242,20.425619834710744
607,jupyter,https://github.com/connorferster/handcalcs,,,,connorferster/handcalcs,handcalcs,4894,385,75,[],CSS,,handcalcs: Python library for converting Python calculations into rendered latex.,connorferster,2022-09-14,2022-07-04,2020-02-19,134,36.48349307774228
81,util,https://github.com/sphinx-doc/sphinx,,,,sphinx-doc/sphinx,sphinx,4888,1753,138,"['python', 'documentation', 'documentation-tool', 'sphinx']",Python,https://www.sphinx-doc.org,sphinx: Main repository for the Sphinx documentation builder,sphinx-doc,2022-09-14,2022-09-13,2015-01-02,401,12.16352648418059
281,jupyter,https://github.com/nteract/papermill,,,,nteract/papermill,papermill,4874,374,92,"['jupyter', 'notebooks', 'notebook-generator', 'nteract', 'publishing', 'pipeline', 'notebook', 'python', 'r', 'julia', 'scala']",Python,http://papermill.readthedocs.io/en/latest/,"papermill: 📚 Parameterize, execute, and analyze notebooks",nteract,2022-09-14,2022-08-15,2017-07-06,271,17.985239852398525
406,perf,https://github.com/python-trio/trio,,,,python-trio/trio,trio,4870,280,87,"['python', 'async', 'async-await', 'networking', 'io', 'trio', 'structured-concurrency']",Python,https://trio.readthedocs.io,Trio – a friendly Python library for async concurrency and I/O,python-trio,2022-09-14,2022-09-14,2017-01-16,295,16.484526112185687
3,ml,https://github.com/awslabs/autogluon,,,,awslabs/autogluon,autogluon,4804,636,89,"['automl', 'machine-learning', 'data-science', 'deep-learning', 'ensemble-learning', 'image-classification', 'computer-vision', 'natural-language-processing', 'structured-data', 'object-detection', 'gluon', 'transfer-learning', 'pytorch', 'automated-machine-learning', 'scikit-learn', 'autogluon', 'tabular-data', 'hyperparameter-optimization']",Python,https://auto.gluon.ai/,"AutoGluon: AutoML for Image, Text, and Tabular Data",awslabs,2022-09-15,2022-09-14,2019-07-29,163,29.395104895104897
571,ml,https://github.com/mdbloice/augmentor,,,,mdbloice/augmentor,Augmentor,4789,850,125,"['augmentation', 'machine-learning', 'deep-learning', 'neural-networks']",Python,https://augmentor.readthedocs.io/en/stable,Augmentor: Image augmentation library in Python for machine learning.,mdbloice,2022-09-14,2022-09-12,2016-03-01,341,14.03223105902051
354,ml-ops,https://github.com/activeloopai/hub,,,,activeloopai/hub,Hub,4778,396,58,"['datasets', 'data-pipelines', 'deep-learning', 'machine-learning', 'data-science', 'pytorch', 'tensorflow', 'data-version-control', 'python', 'ai', 'ml', 'mlops', 'computer-vision', 'cv', 'data-processing', 'cloud-computing', 'image-processing', 'data-centric', 'gsoc', 'jupyter-notebook']",Python,https://activeloop.ai,"Hub: Dataset format for AI. Build, manage, query & visualize datasets for deep learning. Stream data real-time to PyTorch/TensorFlow & version-control it. https://activeloop.ai ",activeloopai,2022-09-14,2022-09-15,2019-08-09,161,29.519858781994703
171,nlp,https://github.com/minimaxir/textgenrnn,,,,minimaxir/textgenrnn,textgenrnn,4762,752,141,"['keras', 'deep-learning', 'text-generation', 'tensorflow', 'python']",Python,,textgenrnn: Easily train your own text-generating neural network of any size and complexity on any text dataset with a few lines of code.,minimaxir,2022-09-14,2020-07-14,2017-08-07,266,17.873458445040214
163,ml,https://github.com/wandb/client,,,,wandb/client,wandb,4719,358,35,"['machine-learning', 'experiment-track', 'deep-learning', 'keras', 'tensorflow', 'pytorch', 'hyperparameter-search', 'reinforcement-learning', 'mlops', 'data-science', 'collaboration', 'hyperparameter-optimization', 'reproducibility', 'hyperparameter-tuning', 'data-versioning', 'model-versioning', 'ml-platform']",Python,https://wandb.ai,wandb: 🔥 A tool for visualizing and tracking your machine learning experiments. This repo contains the CLI and Python API.,wandb,2022-09-15,2022-09-14,2017-03-24,285,16.50824587706147
663,study,https://github.com/udacity/deep-learning-v2-pytorch,,,,udacity/deep-learning-v2-pytorch,deep-learning-v2-pytorch,4714,5125,173,"['deep-learning', 'neural-network', 'convolutional-networks', 'pytorch', 'recurrent-networks', 'style-transfer', 'sentiment-analysis']",Jupyter Notebook,,deep-learning-v2-pytorch: Projects and exercises for the latest Deep Learning ND program https://www.udacity.com/course/deep-learning-nanodegree--nd101,udacity,2022-09-14,2022-08-01,2018-09-04,210,22.41711956521739
540,nlp,https://github.com/nvidia/nemo,,,,nvidia/nemo,NeMo,4711,1152,131,"['deep-learning', 'speech-recognition', 'nlp', 'nlp-machine-learning', 'neural-network', 'machine-translation', 'speech-synthesis', 'speech-to-text', 'text-to-speech', 'nmt', 'language-model', 'speaker-diarization', 'speaker-recognition', 'text-normalization', 'asr', 'tts']",Python,https://nvidia.github.io/NeMo/,NeMo: a toolkit for conversational AI,nvidia,2022-09-14,2022-09-14,2019-08-05,162,29.003518029903255
688,util,https://github.com/py-pdf/pypdf2,,,,py-pdf/pypdf2,PyPDF2,4694,1110,139,"['pypdf2', 'pdf', 'python', 'pdf-parser', 'pdf-parsing', 'pdf-manipulation', 'pdf-documents', 'help-wanted']",Python,https://pypdf2.readthedocs.io/en/latest/,"PyPDF2: A pure-python PDF library capable of splitting, merging, cropping, and transforming the pages of PDF files",py-pdf,2022-09-15,2022-09-14,2012-01-06,557,8.414340588988477
644,util,https://github.com/pycqa/pycodestyle,,,,pycqa/pycodestyle,pycodestyle,4682,664,122,"['python', 'pep8', 'styleguide', 'style-guide', 'linter-plugin', 'linter-flake8', 'flake8-plugin']",Python,https://pycodestyle.pycqa.org,pycodestyle: Simple Python style checker in one Python file,pycqa,2022-09-14,2022-08-09,2009-10-02,675,6.927499471570492
15,ml-dl,https://github.com/skorch-dev/skorch,,,,skorch-dev/skorch,skorch,4673,319,79,"['scikit-learn', 'pytorch', 'machine-learning']",Jupyter Notebook,,skorch: A scikit-learn compatible neural network library that wraps PyTorch,skorch-dev,2022-09-14,2022-09-05,2017-07-18,269,17.353315649867373
654,perf,https://github.com/joerick/pyinstrument,,,,joerick/pyinstrument,pyinstrument,4662,193,53,"['python', 'django', 'profiler', 'performance', 'profile', 'async']",Python,https://pyinstrument.readthedocs.io/,pyinstrument: 🚴 Call stack profiler for Python. Shows you why your code is slow!,joerick,2022-09-15,2022-08-21,2014-03-13,444,10.5
382,data,https://github.com/alirezamika/autoscraper,,,,alirezamika/autoscraper,autoscraper,4624,492,124,"['scraping', 'scraper', 'scrape', 'webscraping', 'crawler', 'web-scraping', 'ai', 'artificial-intelligence', 'python', 'webautomation', 'automation', 'machine-learning']",Python,,"autoscraper: A Smart, Automatic, Fast and Lightweight Web Scraper for Python",alirezamika,2022-09-14,2022-07-17,2020-08-31,106,43.44697986577181
473,util,https://github.com/parthjadhav/tkinter-designer,,,,parthjadhav/tkinter-designer,Tkinter-Designer,4562,407,49,"['tkinter', 'tkinter-gui', 'tkinter-python', 'tkinter-graphic-interface', 'python3', 'tkinter-widgets', 'gui-application', 'python-script', 'drag-and-drop', 'easy', 'easy-to-use', 'fast', 'gui', 'tkinter-designer', 'figma', 'python', 'automatic', 'nice', 'collaborate', 'learn']",Python,,Tkinter-Designer: An easy and fast way to create a Python GUI 🐍,parthjadhav,2022-09-14,2022-09-12,2021-05-18,69,65.84329896907217
215,data,https://github.com/facebookresearch/augly,,,,facebookresearch/augly,AugLy,4558,257,61,[],Python,https://ai.facebook.com/blog/augly-a-new-data-augmentation-library-to-help-build-more-robust-ai-models/,"AugLy: A data augmentations library for audio, image, text, and video.",facebookresearch,2022-09-15,2022-09-13,2021-06-09,66,68.91144708423326
216,nlp,https://github.com/speechbrain/speechbrain,,,,speechbrain/speechbrain,speechbrain,4555,883,111,"['speech-recognition', 'speech-toolkit', 'speaker-recognition', 'speech-to-text', 'speech-enhancement', 'speech-separation', 'audio', 'audio-processing', 'speech-processing', 'speechrecognition', 'asr', 'voice-recognition', 'spoken-language-understanding', 'speaker-diarization', 'speaker-verification', 'pytorch', 'huggingface', 'transformers', 'language-model', 'deep-learning']",Python,http://speechbrain.github.io,speechbrain: A PyTorch-based Speech Toolkit,speechbrain,2022-09-15,2022-09-14,2020-04-28,124,36.64942528735632
267,util,https://github.com/pytransitions/transitions,,,,pytransitions/transitions,transitions,4547,501,93,"['python', 'state-machine', 'nested-states', 'hierarchical-state-machine', 'state-diagram']",Python,,"transitions: A lightweight, object-oriented finite state machine implementation in Python with many extensions",pytransitions,2022-09-14,2022-09-02,2014-10-12,413,10.99447322970639
689,util,https://github.com/bndr/pipreqs,,,,bndr/pipreqs,pipreqs,4505,313,60,[],Python,,pipreqs - Generate pip requirements.txt file based on imports of any project. Looking for maintainers to move this project forward.,bndr,2022-09-15,2021-10-23,2015-04-22,386,11.666666666666666
515,util,https://github.com/agronholm/apscheduler,,,,agronholm/apscheduler,apscheduler,4501,590,125,[],Python,,apscheduler: Task scheduling library for Python,agronholm,2022-09-15,2022-09-12,2016-03-27,337,13.333474396953026
183,security,https://github.com/pycqa/bandit,,,,pycqa/bandit,bandit,4458,474,58,"['linter', 'bandit', 'security-tools', 'security-scanner', 'security', 'static-code-analysis', 'python']",Python,https://bandit.readthedocs.io,Bandit is a tool designed to find common security issues in Python code.,pycqa,2022-09-14,2022-09-14,2018-04-26,229,19.467248908296945
249,util,https://github.com/jorgebastida/awslogs,,,,jorgebastida/awslogs,awslogs,4445,325,62,[],Python,,awslogs: AWS CloudWatch logs for Humans™,jorgebastida,2022-09-14,2020-07-10,2015-01-21,399,11.136363636363637
225,nlp,https://github.com/kingoflolz/mesh-transformer-jax,1.0,,,kingoflolz/mesh-transformer-jax,mesh-transformer-jax,4433,608,71,[],Python,,mesh-transformer-jax: Model parallel transformers in JAX and Haiku,kingoflolz,2022-09-14,2022-01-28,2021-03-13,78,56.31760435571688
554,ml,https://github.com/open-mmlab/mmsegmentation,,,,open-mmlab/mmsegmentation,mmsegmentation,4395,1627,52,"['semantic-segmentation', 'pytorch', 'pspnet', 'deeplabv3', 'transformer', 'swin-transformer', 'realtime-segmentation', 'vessel-segmentation', 'retinal-vessel-segmentation', 'image-segmentation', 'medical-image-segmentation']",Python,https://mmsegmentation.readthedocs.io/en/latest/,mmsegmentation: OpenMMLab Semantic Segmentation Toolbox and Benchmark.,open-mmlab,2022-09-14,2022-09-14,2020-06-14,117,37.38153098420413
97,jupyter,https://github.com/voila-dashboards/voila,,,,voila-dashboards/voila,voila,4326,432,77,"['jupyter', 'jupyter-notebook', 'jupyterlab-extension', 'dashboarding']",Python,https://voila.readthedocs.io,voila: Voilà turns Jupyter notebooks into standalone web applications,voila-dashboards,2022-09-15,2022-09-08,2018-08-21,212,20.378196500672946
208,ml,https://github.com/lucidrains/deep-daze,,,,lucidrains/deep-daze,deep-daze,4324,317,75,"['artificial-intelligence', 'deep-learning', 'transformers', 'siren', 'implicit-neural-representation', 'text-to-image', 'multi-modality']",Python,,deep-daze: Simple command line tool for text to image generation using OpenAI's CLIP and Siren (Implicit neural representation network). Technique was originally created by https://twitter.com/advadnoun,lucidrains,2022-09-14,2022-03-13,2021-01-17,86,49.947194719471945
553,ml,https://github.com/open-mmlab/mmcv,,,,open-mmlab/mmcv,mmcv,4303,1209,81,[],Python,https://mmcv.readthedocs.io/en/latest/,mmcv: OpenMMLab Computer Vision Foundation,open-mmlab,2022-09-15,2022-09-14,2018-08-22,212,20.283501683501683
314,util,https://github.com/indygreg/pyoxidizer,,,,indygreg/pyoxidizer,PyOxidizer,4285,184,60,[],Rust,,PyOxidizer: A modern Python application packaging and distribution tool,indygreg,2022-09-14,2022-09-06,2018-12-18,195,21.942209217264082
21,nlp,https://github.com/facebookresearch/drqa,,,,facebookresearch/drqa,DrQA,4270,898,166,[],Python,,DrQA: Reading Wikipedia to Answer Open-Domain Questions,facebookresearch,2022-09-14,2021-05-18,2017-07-07,270,15.764767932489452
66,util,https://github.com/pycqa/pylint,,,,pycqa/pylint,pylint,4209,904,73,"['static-analysis', 'linter', 'static-code-analysis', 'code-quality', 'pep8', 'closember']",Python,http://pylint.pycqa.org,pylint: It's not just a linter that annoys you!,pycqa,2022-09-13,2022-09-13,2015-12-09,353,11.91868932038835
198,viz,https://github.com/lux-org/lux,,,,lux-org/lux,lux,4185,330,85,"['visualization-tools', 'jupyter', 'python', 'data-science', 'exploratory-data-analysis', 'visualization', 'pandas']",Python,,lux: Automatically visualize your pandas dataframe via a single print! 📊 💡,lux-org,2022-09-14,2022-05-21,2020-01-08,140,29.862385321100916
719,data,https://github.com/jazzband/tablib,,,,jazzband/tablib,tablib,4161,569,143,[],Python,https://tablib.readthedocs.io/,"tablib: Python Module for Tabular Datasets in XLS, CSV, JSON, YAML, &c.",jazzband,2022-09-09,2022-07-11,2011-03-28,598,6.953210790164717
572,util,https://github.com/jd/tenacity,,,,jd/tenacity,tenacity,4097,208,44,"['python', 'failure', 'retry', 'retry-library']",Python,http://tenacity.readthedocs.io,tenacity: Retrying library for Python,jd,2022-09-15,2022-05-30,2016-08-11,318,12.883647798742139
101,ml,https://github.com/rasbt/mlxtend,,,,rasbt/mlxtend,mlxtend,4066,776,120,"['python', 'machine-learning', 'data-science', 'data-mining', 'association-rules', 'supervised-learning', 'unsupervised-learning']",Python,http://rasbt.github.io/mlxtend/,mlxtend: A library of extension and helper modules for Python's data analysis and machine learning libraries.,rasbt,2022-09-14,2022-09-14,2014-08-14,422,9.635071090047393
736,ml-dl,https://github.com/pytorch/ignite,1.0,,,pytorch/ignite,ignite,4043,554,59,"['pytorch', 'neural-network', 'python', 'machine-learning', 'deep-learning', 'metrics', 'hacktoberfest']",Python,https://pytorch-ignite.ai,ignite: High-level library to help with training and evaluating neural networks in PyTorch flexibly and transparently.,pytorch,2022-09-14,2022-09-09,2017-11-23,251,16.10756972111554
295,util,https://github.com/pytoolz/toolz,,,,pytoolz/toolz,toolz,4030,246,82,[],Python,http://toolz.readthedocs.org/,toolz: A functional standard library for Python.,pytoolz,2022-09-15,2022-08-18,2013-09-13,469,8.577075098814229
