,category,githuburl,featured,links,description,_repopath,_reponame,_stars,_forks,_watches,_topics,_language,_homepage,_description,_organization,_updated_at,_last_commit_date,_created_at,_age_weeks,_stars_per_week
9,ml,https://github.com/contextlab/hypertools,,,,contextlab/hypertools,hypertools,1737,157,60,"['data-visualization', 'high-dimensional-data', 'python', 'topic-modeling', 'text-vectorization', 'data-wrangling', 'visualization', 'time-series']",Python,http://hypertools.readthedocs.io/en/latest/,hypertools: A Python toolbox for gaining geometric insights into high-dimensional data,contextlab,2022-09-14,2022-02-12,2016-09-27,311,5.580082606700321
726,util,https://github.com/ashleve/lightning-hydra-template,,,,ashleve/lightning-hydra-template,lightning-hydra-template,1731,277,17,"['pytorch-lightning', 'wandb', 'project-structure', 'config', 'deep-learning', 'hydra', 'template', 'pytorch', 'research', 'experiments', 'reproducibility', 'experiment-tracking', 'best-practices', 'neptune', 'mlflow', 'tensorboard', 'comet', 'mlops']",Python,,lightning-hydra-template: PyTorch Lightning + Hydra. A very user-friendly template for rapid and reproducible ML experimentation with best practices.  ⚡🔥⚡,ashleve,2022-09-14,2022-09-12,2020-11-04,97,17.819117647058825
32,nlp,https://github.com/jamesturk/jellyfish,,,,jamesturk/jellyfish,jellyfish,1718,150,43,"['python', 'levenshtein', 'soundex', 'hamming', 'metaphone', 'jaro-winkler', 'fuzzy-search', 'hacktoberfest']",Python,https://jamesturk.github.io/jellyfish/,jellyfish: 🎐 a python library for doing approximate and phonetic matching of strings.,jamesturk,2022-09-14,2022-09-12,2010-07-09,635,2.7018647494944954
755,study,https://github.com/karpathy/nn-zero-to-hero,,,,karpathy/nn-zero-to-hero,nn-zero-to-hero,1718,58,79,[],Jupyter Notebook,,nn-zero-to-hero: Neural Networks: Zero to Hero,karpathy,2022-09-15,2022-09-12,2022-09-08,1,1718.0
312,data,https://github.com/graphistry/pygraphistry,,,,graphistry/pygraphistry,pygraphistry,1699,180,46,"['graph', 'visualization', 'gpu', 'analytics', 'graphistry', 'python', 'notebooks', 'dashboards', 'rapids', 'cugraph', 'networkx', 'neo4j', 'tigergraph', 'pandas', 'csv', 'webgl', 'cuda', 'splunk', 'cudf', 'blazingsql']",Python,,"PyGraphistry is a Python library to quickly load, shape, embed, and explore big graphs with the GPU-accelerated Graphistry visual graph analyzer",graphistry,2022-09-14,2022-09-07,2015-06-02,380,4.467693463561232
63,sim,https://github.com/projectmesa/mesa,,,,projectmesa/mesa,mesa,1699,728,93,"['mesa', 'agent-based-modeling', 'agent-based-simulation', 'simulation-framework', 'simulation', 'simulation-environment', 'complex-systems', 'complexity-analysis', 'modeling-agents', 'spatial-models', 'gis']",Python,,Mesa is an agent-based modeling framework in Python,projectmesa,2022-09-14,2022-09-07,2014-09-19,416,4.075736806031529
203,util,https://github.com/camelot-dev/camelot,,,,camelot-dev/camelot,camelot,1668,317,36,[],Python,https://camelot-py.readthedocs.io,camelot: A Python library to extract tabular data from PDFs,camelot-dev,2022-09-15,2021-07-11,2019-07-01,167,9.96245733788396
367,ml,https://github.com/rentruewang/koila,,,,rentruewang/koila,koila,1665,55,10,"['pytorch', 'lazy-evaluation', 'out-of-memory', 'python', 'machine-learning', 'deep-learning', 'memory-management', 'gradient-accumulation', 'neural-network']",Python,https://rentruewang.github.io/koila,koila: Prevent PyTorch's `CUDA error: out of memory` in just 1 line of code.,rentruewang,2022-09-12,2022-06-03,2021-11-17,43,38.59271523178808
418,ml,https://github.com/bmabey/pyldavis,,,,bmabey/pyldavis,pyLDAvis,1641,336,57,[],Jupyter Notebook,,pyLDAvis: Python library for interactive topic model visualization. Port of the R LDAvis package.,bmabey,2022-09-12,2021-03-24,2015-04-09,388,4.229381443298969
508,ml-ops,https://github.com/adap/flower,,,,adap/flower,flower,1635,334,25,"['flower', 'federated-learning', 'federated-learning-framework', 'pytorch-federated-learning', 'tensorflow-federated-learning', 'keras-federated-learning', 'federated-analytics', 'fleet-learning', 'fleet-intelligence']",Python,https://flower.dev,Flower - A Friendly Federated Learning Framework,adap,2022-09-15,2022-09-15,2020-02-17,134,12.16259298618491
454,data,https://github.com/pandera-dev/pandera,1.0,,,pandera-dev/pandera,pandera,1634,131,14,"['pandas', 'validation', 'schema', 'dataframes', 'testing', 'pandas-validation', 'pandas-dataframe', 'data-validation', 'data-cleaning', 'data-check', 'testing-tools', 'assertions', 'data-assertions', 'data-verification', 'dataframe-schema', 'hypothesis-testing', 'pandas-validator', 'data-processing']",Python,https://pandera.readthedocs.io,"pandera: A light-weight, flexible, and expressive statistical data testing library",pandera-dev,2022-09-12,2022-08-22,2018-11-01,202,8.089108910891088
25,util,https://github.com/google/gin-config,,,,google/gin-config,gin-config,1630,103,22,"['python', 'configuration-management', 'tensorflow', 'tensorflow-experiments']",Python,,gin-config: Gin provides a lightweight configuration framework for Python,google,2022-09-14,2022-05-27,2018-06-27,220,7.404282933160285
299,util,https://github.com/pyparsing/pyparsing,,,,pyparsing/pyparsing,pyparsing,1630,229,21,"['python', 'python2', 'python3', 'python-2', 'python-3', 'parser-combinators', 'parsing-expression-grammar', 'parsing', 'parsing-library', 'text-processing', 'peg-parsers']",Python,,pyparsing: Python library for creating PEG parsers,pyparsing,2022-09-15,2022-08-29,2017-05-14,278,5.851282051282051
332,nlp,https://github.com/franck-dernoncourt/neuroner,,,,franck-dernoncourt/neuroner,NeuroNER,1627,479,84,"['nlp', 'machine-learning', 'neural-networks', 'named-entity-recognition', 'deep-learning', 'tensorflow']",Python,http://neuroner.com,NeuroNER: Named-entity recognition using neural networks. Easy-to-use and state-of-the-art results.,franck-dernoncourt,2022-09-14,2019-10-02,2017-03-07,288,5.643706640237859
426,util,https://github.com/gotcha/ipdb,,,,gotcha/ipdb,ipdb,1600,140,27,"['python', 'ipython', 'debugger']",Python,,ipdb: Integration of IPython pdb,gotcha,2022-09-14,2021-12-30,2011-01-15,608,2.6284909645623094
219,ml,https://github.com/linkedin/greykite,1.0,,,linkedin/greykite,greykite,1592,80,35,[],Python,,"greykite: A flexible, intuitive and fast forecasting library",linkedin,2022-09-14,2022-08-31,2021-04-27,72,22.023715415019762
304,template,https://github.com/pyscaffold/pyscaffold,,,,pyscaffold/pyscaffold,pyscaffold,1573,164,40,"['python', 'release-automation', 'git', 'distribution', 'package-creation', 'template-project', 'project-template', 'package']",Python,https://pyscaffold.org,pyscaffold: 🛠 Python project template generator with batteries included,pyscaffold,2022-09-13,2022-09-06,2014-04-02,441,3.565738341968912
701,util,https://github.com/grantjenks/python-diskcache,,,,grantjenks/python-diskcache,python-diskcache,1567,104,17,"['python', 'cache', 'persistence', 'key-value-store', 'filesystem']",Python,http://www.grantjenks.com/docs/diskcache/,python-diskcache: Python disk-backed cache (Django-compatible). Faster than Redis and Memcached. Pure-Python.,grantjenks,2022-09-14,2022-02-20,2016-02-03,345,4.540149006622516
511,ml,https://github.com/tensorflow/addons,,,,tensorflow/addons,addons,1562,584,54,"['machine-learning', 'deep-learning', 'tensorflow', 'neural-network', 'tensorflow-addons', 'python']",Python,,addons: Useful extra functionality for TensorFlow 2.x maintained by SIG-addons,tensorflow,2022-09-15,2022-08-24,2018-11-26,198,7.871850251979842
545,data,https://github.com/sqlalchemy/alembic,,,,sqlalchemy/alembic,alembic,1550,163,19,"['sqlalchemy', 'sql', 'python']",Python,,alembic: A database migrations tool for SQLAlchemy.,sqlalchemy,2022-09-14,2022-09-11,2018-11-27,198,7.81700288184438
144,nlp,https://github.com/plasticityai/magnitude,,,,plasticityai/magnitude,magnitude,1540,108,37,"['python', 'natural-language-processing', 'nlp', 'machine-learning', 'vectors', 'embeddings', 'word2vec', 'fasttext', 'glove', 'gensim', 'fast', 'memory-efficient', 'machine-learning-library', 'word-embeddings']",Python,,"magnitude: A fast, efficient universal vector embedding utility package.",plasticityai,2022-09-13,2020-07-17,2018-02-24,237,6.478365384615385
385,nlp,https://github.com/minimaxir/aitextgen,,,,minimaxir/aitextgen,aitextgen,1531,180,38,[],Python,https://docs.aitextgen.io,aitextgen: A robust Python tool for text-based AI training and generation using GPT-2.,minimaxir,2022-09-14,2022-08-09,2019-12-29,141,10.814328960645812
265,sim,https://github.com/quantecon/quantecon.py,,,,quantecon/quantecon.py,QuantEcon.py,1524,2090,152,[],Python,https://quantecon.org/quantecon-py/,QuantEcon.py: A community based Python library for quantitative economics,quantecon,2022-09-10,2022-07-01,2013-03-22,494,3.079676674364896
258,crypto,https://github.com/bmoscon/cryptofeed,,,,bmoscon/cryptofeed,cryptofeed,1518,504,74,"['python', 'trading', 'market-data', 'cryptocurrency', 'bitcoin', 'exchange', 'websockets', 'coinbase', 'binance', 'influxdb', 'asyncio', 'websocket', 'ftx-exchange', 'trading-platform', 'ethereum', 'cryptocurrencies', 'btc', 'crypto', 'coinbase-api']",Python,,cryptofeed: Cryptocurrency Exchange Websocket Data Feed Handler,bmoscon,2022-09-14,2022-09-04,2017-12-16,247,6.1280276816609
313,util,https://github.com/linkedin/shiv,,,,linkedin/shiv,shiv,1503,85,27,[],Python,,"shiv is a command line utility for building fully self contained Python zipapps as outlined in PEP 441, but with all their dependencies included.",linkedin,2022-09-14,2022-09-13,2018-03-13,235,6.387978142076503
637,util,https://github.com/alexmojaki/birdseye,,,,alexmojaki/birdseye,birdseye,1501,75,41,"['python-debugger', 'python', 'debugger', 'debugging', 'birdseye', 'ast']",JavaScript,https://birdseye.readthedocs.io,birdseye: Graphical Python debugger which lets you easily view the values of all evaluated expressions,alexmojaki,2022-09-13,2022-05-18,2017-07-22,268,5.585858585858586
598,data,https://github.com/uber/petastorm,,,,uber/petastorm,petastorm,1496,259,40,"['tensorflow', 'pytorch', 'deep-learning', 'machine-learning', 'sysml', 'pyspark', 'pyarrow', 'parquet', 'parquet-files']",Python,,"Petastorm library enables single machine or distributed training and evaluation of deep learning models from datasets in Apache Parquet format. It supports ML frameworks such as Tensorflow, Pytorch, and PySpark and can be used from pure Python code.",uber,2022-09-14,2022-09-14,2018-06-15,221,6.74307791371539
379,ml-interpretability,https://github.com/jalammar/ecco,,,,jalammar/ecco,ecco,1485,99,18,"['nlp', 'visualization', 'explorables', 'natural-language-processing', 'pytorch', 'language-models']",Jupyter Notebook,https://ecco.readthedocs.io,"ecco: Explain, analyze, and visualize NLP language models. Ecco creates interactive visualizations directly in Jupyter notebooks explaining the behavior of Transformer-based language models (like GPT2, BERT, RoBERTA, T5, and T0).",jalammar,2022-09-09,2022-01-18,2020-11-07,96,15.35450516986706
734,study,https://github.com/amanchadha/coursera-deep-learning-specialization,,,,amanchadha/coursera-deep-learning-specialization,coursera-deep-learning-specialization,1475,1364,12,"['deep-learning', 'coursera', 'coursera-assignment', 'coursera-specialization', 'coursera-machine-learning', 'andrew-ng', 'andrew-ng-course', 'convolutional-neural-networks', 'cnns', 'recurrent-neural-networks', 'rnns', 'convolutional-neural-network', 'recurrent-neural-network', 'hyperparameter-optimization', 'hyperparameter-tuning', 'neural-network', 'neural-networks', 'neural-machine-translation', 'neural-style-transfer', 'regularization']",Jupyter Notebook,,"coursera-deep-learning-specialization: Notes, programming assignments and quizzes from all courses within the Coursera Deep Learning specialization offered by deeplearning.ai: (i) Neural Networks and Deep Learning; (ii) Improving Deep Neural Networks: Hyperparameter tuning, Regularization and Optimization; (iii) Structuring Machine Learning Projects; (iv) Convolutional Neural Networks; (v) Sequence Models",amanchadha,2022-09-14,2022-02-07,2020-06-24,116,12.699876998769987
207,perf,https://github.com/alexmojaki/heartrate,,,,alexmojaki/heartrate,heartrate,1463,118,29,"['python', 'visualization', 'debugger']",Python,,heartrate: Simple real time visualisation of the execution of a Python program.,alexmojaki,2022-09-11,2021-11-13,2019-04-24,177,8.258870967741936
599,ml,https://github.com/uber/orbit,,,,uber/orbit,orbit,1462,110,31,"['python', 'forecasting', 'bayesian', 'exponential-smoothing', 'pyro', 'stan', 'pystan', 'probabilistic-programming', 'probabilistic', 'forecast', 'orbit', 'time-series', 'regression', 'arima', 'changepoint', 'bayesian-methods', 'bayesian-statistics', 'machine-learning', 'regression-models', 'pytorch']",Python,https://orbit-ml.readthedocs.io/en/stable/,orbit: A Python package for Bayesian forecasting with object-oriented design and probabilistic models under the hood.,uber,2022-09-14,2022-09-14,2020-01-07,140,10.421588594704684
301,util,https://github.com/julienpalard/pipe,,,,julienpalard/pipe,Pipe,1462,98,23,[],Python,,Pipe: A Python library to use infix notation in Python,julienpalard,2022-09-15,2022-07-07,2010-04-08,649,2.2526964560862868
500,ml-dl,https://github.com/vt-vl-lab/fgvc,,,,vt-vl-lab/fgvc,FGVC,1459,235,68,[],Python,,FGVC: [ECCV 2020] Flow-edge Guided Video Completion ,vt-vl-lab,2022-09-15,2021-12-14,2020-09-09,105,13.876358695652174
664,util,https://github.com/numba/llvmlite,,,,numba/llvmlite,llvmlite,1447,276,54,[],Python,http://llvmlite.pydata.org/,llvmlite: A lightweight LLVM python binding for writing JIT compilers,numba,2022-09-09,2022-09-01,2014-08-07,423,3.42080378250591
614,testing,https://github.com/pytest-dev/pytest-mock,,,,pytest-dev/pytest-mock,pytest-mock,1446,112,33,"['pytest', 'mock', 'hacktoberfest']",Python,,pytest-mock: Thin-wrapper around the mock package for easier use with pytest,pytest-dev,2022-09-14,2022-09-09,2014-07-17,426,3.3943661971830985
197,sim,https://github.com/pettingzoo-team/pettingzoo,,,,pettingzoo-team/pettingzoo,PettingZoo,1410,219,14,[],Python,,PettingZoo: Gym for multi-agent reinforcement learning,pettingzoo-team,2022-09-15,2022-09-12,2020-01-20,138,10.185758513931889
108,util,https://github.com/nficano/python-lambda,,,,nficano/python-lambda,python-lambda,1404,227,31,"['python', 'aws', 'aws-lambda', 'microservices', 'serverless']",Python,,python-lambda:  A toolkit for developing and deploying serverless Python code in AWS Lambda. ,nficano,2022-09-12,2022-06-03,2016-02-26,341,4.106978687839532
640,perf,https://github.com/dask/distributed,,,,dask/distributed,distributed,1394,645,59,"['pydata', 'dask', 'distributed-computing', 'python', 'hacktoberfest']",Python,https://distributed.dask.org,distributed: A distributed task scheduler for Dask,dask,2022-09-14,2022-09-09,2015-09-13,365,3.8132082844861275
226,sim,https://github.com/google/brax,,,,google/brax,brax,1393,138,32,"['jax', 'reinforcement-learning', 'robotics', 'physics-simulation']",Jupyter Notebook,,brax: Massively parallel rigidbody physics simulation on accelerator hardware.,google,2022-09-15,2022-09-09,2021-06-02,67,20.7468085106383
326,security,https://github.com/pyupio/safety,,,,pyupio/safety,safety,1360,120,31,"['python', 'security', 'security-vulnerability', 'travis', 'vulnerability-scanners', 'vulnerability-detection']",Python,https://pyup.io/safety/,Safety checks Python dependencies for known security vulnerabilities and suggests the proper remediations for vulnerabilities detected.,pyupio,2022-09-15,2022-09-14,2016-10-19,308,4.413537320352341
286,data,https://github.com/sdispater/orator,,,,sdispater/orator,orator,1356,166,44,"['python', 'orm', 'database']",Python,https://orator-orm.com,orator: The Orator ORM provides a simple yet beautiful ActiveRecord implementation.,sdispater,2022-09-08,2022-03-13,2015-05-24,381,3.553725196555597
460,ml-dl,https://github.com/nebuly-ai/nebullvm,,,,nebuly-ai/nebullvm,nebullvm,1348,60,16,"['deep-learning', 'pytorch', 'onnx', 'machine-learning', 'tensorflow', 'tvm', 'openvino', 'tensorrt', 'huggingface', 'compiler', 'computing', 'inference']",Python,,nebullvm: Accelerate AI models inference leveraging best-of-breed optimization techniques 🚀,nebuly-ai,2022-09-14,2022-09-12,2022-02-12,30,43.88837209302326
269,nlp,https://github.com/arxiv-vanity/arxiv-vanity,,,,arxiv-vanity/arxiv-vanity,arxiv-vanity,1348,85,23,"['latex', 'academic-publishing', 'science', 'arxiv']",Python,https://www.arxiv-vanity.com,arxiv-vanity: Renders papers from arXiv as responsive web pages so you don't have to squint at a PDF.,arxiv-vanity,2022-09-12,2022-01-18,2017-08-12,265,5.073118279569893
431,jupyter,https://github.com/jupyter-lsp/jupyterlab-lsp,,,,jupyter-lsp/jupyterlab-lsp,jupyterlab-lsp,1337,113,17,"['jupyterlab', 'jupyterlab-extension', 'language-server-protocol', 'jupyter-lab', 'lsp', 'linter', 'jupyter', 'jupyter-notebook', 'notebook', 'notebook-jupyter', 'ipython', 'autocompletion', 'julia-language', 'r']",TypeScript,,jupyterlab-lsp: Coding assistance for JupyterLab (code navigation + hover suggestions + linters + autocompletion + rename) using Language Server Protocol,jupyter-lsp,2022-09-14,2022-09-03,2019-08-17,160,8.319111111111111
150,data,https://github.com/simple-salesforce/simple-salesforce,,,,simple-salesforce/simple-salesforce,simple-salesforce,1335,593,90,"['salesforce', 'api', 'api-client', 'python']",Python,,simple-salesforce: A very simple Salesforce.com REST API client for Python,simple-salesforce,2022-09-15,2022-09-12,2013-01-17,504,2.6488095238095237
593,template,https://github.com/buuntu/fastapi-react,,,,buuntu/fastapi-react,fastapi-react,1314,217,34,"['fastapi', 'postgres', 'cookiecutter', 'react', 'react-admin', 'nginx', 'boilerplate', 'full-stack', 'typescript', 'sqlalchemy', 'jwt', 'oauth2', 'docker']",Python,,"fastapi-react: 🚀   Cookiecutter Template for FastAPI + React Projects.  Using PostgreSQL, SQLAlchemy, and Docker",buuntu,2022-09-13,2022-02-18,2020-03-21,129,10.129955947136564
615,testing,https://github.com/pytest-dev/pytest-cov,,,,pytest-dev/pytest-cov,pytest-cov,1312,182,34,"['pytest', 'python']",Python,,pytest-cov: Coverage plugin for pytest.,pytest-dev,2022-09-13,2022-07-27,2014-04-17,439,2.988610478359909
380,ml-interpretability,https://github.com/oegedijk/explainerdashboard,,,,oegedijk/explainerdashboard,explainerdashboard,1308,174,13,"['dash', 'shap-values', 'dashboard', 'model-predictions', 'data-scientists', 'explainer', 'interactive-dashboards', 'permutation-importances', 'shap', 'plotly', 'inner-workings', 'interactive-plots', 'xai-library', 'xai']",Python,http://explainerdashboard.readthedocs.io,"explainerdashboard: Quickly build Explainable AI dashboards that show the inner workings of so-called ""blackbox"" machine learning models.",oegedijk,2022-09-14,2022-06-16,2019-10-30,150,8.711703139866794
440,geo,https://github.com/giswqs/leafmap,,,,giswqs/leafmap,leafmap,1306,155,40,"['ipyleaflet', 'folium', 'mapping', 'python', 'geopython', 'jupyter-notebook', 'jupyter', 'gis', 'dataviz', 'data-science', 'whiteboxtools', 'geospatial', 'geospatial-analysis', 'leafmap', 'streamlit', 'streamlit-webapp', 'plotly', 'pydeck', 'keplergl']",Python,https://leafmap.org,leafmap: A Python package for interactive mapping and geospatial analysis  with minimal coding in a Jupyter environment,giswqs,2022-09-14,2022-09-09,2021-03-10,79,16.501805054151625
480,ml-dl,https://github.com/tensorflow/mesh,,,,tensorflow/mesh,mesh,1306,228,41,[],Python,,Mesh TensorFlow: Model Parallelism Made Easier,tensorflow,2022-09-14,2022-06-10,2018-09-20,208,6.278846153846154
320,gamedev,https://github.com/pythonarcade/arcade,1.0,,,pythonarcade/arcade,arcade,1292,241,56,"['python3', 'python', 'arcade-framework', 'arcade-api', 'arcade-learning-environment', 'opengl', 'educational-technology', 'educational-resources']",Python,http://arcade.academy,arcade: Easy to use Python library for creating 2D arcade games.,pythonarcade,2022-09-08,2022-09-11,2016-01-04,349,3.6974652493867537
438,nlp,https://github.com/recognai/rubrix,,,,recognai/rubrix,rubrix,1291,114,17,"['python', 'data-science', 'human-in-the-loop', 'natural-language-processing', 'mlops', 'artificial-intelligence', 'knowledge-graph', 'developer-tools', 'text-labeling', 'annotation-tool', 'nlp', 'machine-learning', 'active-learning', 'weak-supervision', 'weakly-supervised-learning', 'spacy', 'text-classification', 'dataops', 'elasticsearch', 'text-annotation']",Python,https://docs.rubrix.ml,"rubrix: ✨ Rubrix, open-source framework for data-centric NLP. Data annotation and monitoring for enterprise NLP",recognai,2022-09-15,2022-09-13,2021-04-28,72,17.895049504950496
661,ml,https://github.com/tensorly/tensorly,,,,tensorly/tensorly,tensorly,1291,255,43,"['machine-learning', 'tensor', 'decomposition', 'tensor-algebra', 'tensorly', 'tensor-learning', 'python', 'tensor-methods', 'pytorch', 'mxnet', 'jax', 'tensorflow', 'cupy', 'numpy', 'tensor-decomposition', 'tensor-factorization', 'tensor-regression', 'regression']",Python,http://tensorly.org,TensorLy: Tensor Learning in Python.,tensorly,2022-09-12,2022-08-29,2016-10-21,307,4.193503480278422
452,geo,https://github.com/jupyter-widgets/ipyleaflet,,,,jupyter-widgets/ipyleaflet,ipyleaflet,1291,348,61,"['jupyterlab-extension', 'leaflet', 'visualization', 'jupyter']",JavaScript,https://ipyleaflet.readthedocs.io,ipyleaflet: A Jupyter - Leaflet.js bridge,jupyter-widgets,2022-09-07,2022-09-03,2014-05-07,436,2.960039305601048
462,nlp,https://github.com/google-research/language,,,,google-research/language,language,1289,302,67,"['natural-language-processing', 'machine-learning', 'research']",Python,https://ai.google/research/teams/language/,language: Shared repository for open-sourced projects from the Google AI Language team.,google-research,2022-09-13,2022-09-07,2018-10-16,204,6.30979020979021
533,ml-dl,https://github.com/neuralmagic/sparseml,,,,neuralmagic/sparseml,sparseml,1259,89,30,"['pytorch', 'keras', 'model-sparsification', 'sparsification-recipes', 'tensorflow', 'smaller-models', 'deep-learning-library', 'deep-learning-algorithms', 'deep-learning-models', 'automl', 'pruning-algorithms', 'sparsity', 'sparsification', 'recipe-driven-approaches', 'pruning', 'computer-vision-algorithms', 'object-detection', 'image-classification', 'nlp', 'onnx']",Python,,"sparseml: Libraries for applying sparsification recipes to neural networks with a few lines of code, enabling faster and smaller models",neuralmagic,2022-09-14,2022-09-14,2020-12-11,91,13.706065318818041
723,util,https://github.com/omry/omegaconf,,,,omry/omegaconf,omegaconf,1256,68,17,"['python', 'yaml', 'yaml-configuration', 'configuration-files', 'configuration-loader', 'python-types', 'schema-validator']",Python,,omegaconf: Flexible Python configuration system. The last one you will ever need.,omry,2022-09-13,2022-08-18,2018-09-03,210,5.96877121520706
319,gamedev,https://github.com/pyglet/pyglet,,,,pyglet/pyglet,pyglet,1221,237,29,"['pyglet', 'python', 'opengl', 'gamedev', 'scientific-visualization']",Python,http://pyglet.org,"pyglet is a cross-platform windowing and multimedia library for Python, for developing games and other visually rich applications.",pyglet,2022-09-13,2022-09-13,2019-06-09,170,7.158291457286432
542,nlp,https://github.com/salesforce/codegen,,,,salesforce/codegen,CodeGen,1204,96,24,"['programsynthesis', 'generativemodel', 'codex', 'languagemodel', 'llm', 'tpu-acceleration']",Python,,CodeGen is an open-source model for program synthesis. Trained on TPU-v4. Competitive with OpenAI Codex.,salesforce,2022-09-15,2022-08-17,2022-03-28,24,49.28654970760234
393,data,https://github.com/mchong6/jojogan,,,,mchong6/jojogan,JoJoGAN,1203,176,23,"['image-translation', 'gans', 'anime']",Jupyter Notebook,,Official PyTorch repo for JoJoGAN: One Shot Face Stylization,mchong6,2022-09-14,2022-02-05,2021-12-17,38,30.959558823529413
750,study,https://github.com/zhanymkanov/fastapi-best-practices,,,,zhanymkanov/fastapi-best-practices,fastapi-best-practices,1201,66,21,"['fastapi', 'best-practices']",,,fastapi-best-practices: FastAPI Best Practices and Conventions we used @ hi.peerlink.me,zhanymkanov,2022-09-15,2022-08-28,2022-08-09,5,227.21621621621622
416,nlp,https://github.com/chrismattmann/tika-python,,,,chrismattmann/tika-python,tika-python,1195,213,36,"['tika-server', 'python', 'tika-python', 'tika-server-jar', 'parser-interface', 'parse', 'translation-interface', 'usc', 'text-extraction', 'mime', 'buffer', 'memex', 'text-recognition', 'detection', 'recognition', 'nlp', 'nlp-machine-learning', 'nlp-library', 'covid-19', 'extraction']",Python,,Tika-Python is a Python binding to the Apache Tika™ REST services allowing Tika to be called natively in the Python community.,chrismattmann,2022-09-12,2021-06-07,2014-06-26,429,2.7855477855477857
678,geo,https://github.com/apache/incubator-sedona,,,,apache/incubator-sedona,incubator-sedona,1178,516,94,"['cluster-computing', 'spatial-sql', 'geospatial', 'spatial-analysis', 'spatial-query', 'scala', 'java', 'python']",Java,http://sedona.apache.org/,incubator-sedona: A cluster computing framework for processing large-scale geospatial data,apache,2022-09-13,2022-09-13,2015-04-24,385,3.0529433543132174
180,nlp,https://github.com/explosion/spacy-models,,,,explosion/spacy-models,spacy-models,1162,269,47,"['spacy', 'nlp', 'natural-language-processing', 'machine-learning', 'models', 'machine-learning-models', 'statistical-models', 'spacy-models']",Python,https://spacy.io,spacy-models: 💫  Models for the spaCy Natural Language Processing (NLP) library,explosion,2022-09-13,2022-08-18,2017-03-14,287,4.044753853804077
